,Unnamed: 0,Tweets,Unnamed: 2,Unnamed: 3,Unnamed: 4
644,645,"Pakistan today observes the martyrdom anniversary of Mohtarama Benzair Bhutto Shaheed. A crusader for human rights & democracy, she left an indelible mark on politics of the country. The void left by her passing has continued to widen over the years.",,,
645,646,"People of IIOJK are waging a relentless struggle of epic proportions to realise their dream of freedom from the Indian yoke. Through their sacrifices, they have kept the torch of freedom burning. It is my faith that their dreams will soon see the light of day.",,,
646,647,We have allocated billions of rupees for targeted subsidies. This amount is in addition to Rs. 344 billion allocated for BISP. Only deserving people to get the subsidy.,,,
647,648,"These are difficult times brought upon us by recent years of economic mismanagement. Through this budget, my govt will steer our way out of these challenges by taking tough decisions while minimising impact on vulnerable segments of population.",,,
648,649,"In this article I wrote for The Guardian, I explain the recovery, rehabilitation & reconstruction challenges facing Pakistan after one of the worst floods due to climate change.",,,
649,650,"Over the years, IDEAS has evolved into a platform that highlights Pakistan's growing footprint in the global defence market. Arms for Peace, theme of IDEAS’22, reflects Pakistan's desire for peace & stability. Good to see that our defence sector is catering to demands of tech era",,,
650,651,Happy Balochi Taqaf Day today to the brave Baloch from the mountains of Bolan to the shores of Gwadar. The beauty of Pakistan is the colors of Balochi civilization and the history of Pakistan is incomplete without the sacrifices of brave Baloch people.,,,
651,652,"So, this Sunday, it’s: 

152/0 vs 170/0 

  #T20WorldCup",,,
652,653,"Today I went to the house of Major Talha Manan, who was martyred in the Balochistan helicopter tragedy, I condoled with the family and offered Fatiha for the martyr. Independence Day cannot be complete without paying tribute to the unforgettable sacrifices of our martyrs. Our martyrs have always protected the holy country with their blood.",,,
653,654,"A big thank you to Heads of states & governments, European Union, our development partners & United Nations for making Resilient Pakistan Conference a resounding success. UN Secretary General has shown stellar leadership all along. People of Pakistan will forever remain grateful.",,,
654,655,I have decided to form a judicial commission to investigate the tragic death of journalist Arshad Sharif so that the facts of this tragic incident can be determined in a transparent and decisive manner.,,,
655,656,"Departing for visit to Turkey. Time has come for Pakistan & Turkey to leverage their excellent bonds to upgrade bilateral ties. Era of regional connectivity, shared development & common destiny calls for a fresh approach. Look forward to discussing this with my brother 
@RTErdogan",,,
656,657,"As humanity navigates multiple challenges & seeks to break the logjam it finds itself in, it must seek guidance from exemplary character of Imam Hussain (ra) & his companions. The virtues of patience, loyalty, unity & tolerance can defeat the forces of division, chaos & anarchy.",,,
657,658,Leaving for Gwadar today. Will review progress on the ongoing development work. Will also oversee the signing of MoU with Indus Hospital for construction of a world-class hospital. Development is meaningless if it does not translate into uplift of local people's lives.,,,
658,659,They have proved that Pakistani women are not behind men in the endurance sport of mountaineering. It is hoped that Samina Baig will continue to wave the flag of Pakistan all over the world with the same spirit.,,,
659,660,"First trip in the Green Line, passenger feedback",,,
660,661,A great day for Pakistan Navy as it has included 2nd MILGEM Class Warship in its fleet. Thanks to H.E. President Tayyip Erdogan for Turkey's cooperation in the defence sector. It signifies the deepening of multipronged partnership between our two brotherly countries.  ,,,
661,662,"All Pakistanis are grateful to all the martyrs of Pakistan Air Force including Squadron Leader Sarfraz Rafiqi, Flight Lieutenant Younis Hasan, Flying Officer Mohammad Afzal, Squadron Leader Muneeruddin, whose great sacrifices crushed the evil ambitions of the enemy 4 times bigger than themselves.",,,
662,663,I am deeply grieved on the loss of precious lives including of our Chinese friends in the heinous attack in Karachi today. My heartfelt condolences go to the bereaved families. I strongly condemn this cowardly act of terrorism. The perpetrators will surely be brought to justice.,,,
663,664,"In a phone call last night, Bill Gates & I discussed polio eradication challenges in our flood-hit areas. Government will continue to work with Bill & Melinda Gates Foundation to ensure no child remains at risk of this deadly virus. I thanked Mr Gates for his consistent support.",,,
664,665,"We welcome the signing of historic Agreement between KSA  & Iran  for resumption of diplomatic relations. This China-mediated deal augurs well for peace, stability & economic development in ME & Muslim world. It shows that with collective wisdom, win-win outcomes are possible",,,
665,666,"I strongly condemn dastardly assassination attempt on  Head of Mission, Kabul. Salute to brave security guard, who took bullet to save his life. Prayers for the swift recovery of security guard. I 
demand immediate investigation & action against perpetrators of this heinous act",,,
666,667,"Today, I attended the funeral of the martyrs of the Balochistan helicopter tragedy and prayed for their elevation. The entire nation, including me, salutes these brave officers and men who sacrificed their lives to help the helpless people trapped in the floods.",,,
667,668,"While we celebrate our hard-earned independence, Pakistan at 75 calls for deep reflection. We have yet to fully realize the dream that our founding fathers dreamed; the dream of socio-economic justice, rule of & equality before the law & the dream of egalitarian society.",,,
668,669,"Ahsan Iqbal's acquittal in the NAB reference proves 2 facts; At the behest of former minister Imran Khan, NAB went to all lengths to implicate PMLN and its leaders in false cases and kept them in illegal detention. The integrity of a noble and honest person like Ahsan Iqbal was proved again with full force.",,,
669,670,"I urge Imran Khan to file a defamation case against Financial Times for publishing an indicting article. If he doesn't & I am sure he wouldn't, it will prove one more time how brazenly he is lying & cheating the people of Pakistan.",,,
670,671,"I launched PM's Youth Business & Agriculture Loan Scheme yesterday. This new scheme builds on a number of youth development programs. From PEEF loans to laptop scheme to self-employment scheme, PML-N has demonstrated its commitment to youth empowerment under leadership of MNS.",,,
671,672,"Land is a limited asset, which is being swallowed up by housing societies. We will introduce measures to discourage unproductive use of land. I am convinced that agriculture can turn around our economy, provided we support it through a set of enabling policies.",,,
672,673,Signing of Trade in Goods Agreement between Pakistan & Turkey today will open up vistas of opportunities. This Agreement will be pivotal in achieving the initial trade target of $5 billion. There is an unlimited potential for bilateral trade. Let the world know we mean business.,,,
673,674,"Today's pre-budget business conference is part of our national dialogue on the economy. I will interact with the business community & other stakeholders associated with commerce, industry and trade. Vital to include their input in economic decision-making.",,,
674,675,"I congratulate His Highness Sheikh Ahmad Nawaf Al Ahmad Al-Jaber Al-Sabah on his appointment as Prime Minister of Kuwait. I look forward to working closely with him to further strengthen Pakistan-Kuwait fraternal relations, rooted deep in shared values & commonality of interests.",,,
675,676,"I extend my heartiest congratulations to H.E. President Qasym-Jamort Toqayev 
@TokayevKZ
 on his victory in Kazakhstan's presidential elections. Both Pakistan & Kazakhstan have excellent brotherly relations & I look forward to working with the President to further deepen them.",,,
676,677,"The disappearance of Army Aviation helicopter from Balochistan is alarming. The entire nation prays to Allah Almighty for the safety, security and return of these sons of the country who came out to help the flood victims. God willing",,,
677,678,"As I stated in my address at UNGA, terrorism continues to threaten not just Afghanistan & Pakistan but also the world. The international community should not let its guard down. Strengthening global cooperation against changing threat matrix of terrorism is need of the hour.",,,
678,679,The delegation came to express Turkey’s soldarity with  at this most difficult time in our history. We derive great strength and confidence from  support and cannot thank President Erdogan enough. This visit reflects unwavering bond of brotherhood between us.,,,
679,680,"As the holy month of Ramazan draws to a close, I want to wish a happy & blessed Eid Mubarak to Muslims & overseas Pakistanis across the world. I also extend warm Eid greetings to my fellow Muslim leaders & reaffirm Pakistan’s resolve to further strengthen our ties.",,,
680,681,"As I continued my interaction with world leaders on day 3 of UNGA Session, there has been a massive outpouring of sympathy & solidarity with Pakistan on flood disaster.Time has come for world to translate this solidarity into concrete action to help Pakistan overcome this crisis.",,,
681,682,"Biraz önce eyalet başbakanlarıyla görüştüm ve onlardan Türkiye'deki depremzedeler için ulusal yardım kampanyasına sahip çıkmalarını istedim. Bu, yüzyılın en büyük depremi. İki Devlet Tek Millet olarak yaşayan bizler her zaman Türk kardeşlerimizin yanında olmaya devam edeceğiz.",,,
682,683,"In my interaction with Turkish business community last night, I expressed my keen desire to take volume of bilateral trade to $5 billion in 2 years. We will take necessary steps to facilitate visas for Turkish citizens & business persons to boost trade & people-to-people contacts",,,
683,684,"While I am in Turkey inking agreements, Imran Niazi is making naked threats against the country. If at all any proof was needed that Niazi is unfit for public office, his latest interview suffices. Do your politics but don't dare to cross limits & talk about division of Pakistan.",,,
684,685,"As Chair of G-77, I will urge the world to deliver on its commitment on climate finance & loss and damage fund. Without financial support, the developing countries will continue to remain exposed to the multifarious threats of climate change. We are asking for climate justice.2/3",,,
685,686,"On the 99th Republic Day of Turkiye, I extend our heartiest felicitations to President 
@RTErdogan
 & the people of Turkiye. The heroic struggle of Turkish people for independence under the leadership of Ghazi Mustafa Kemal Ataturk holds a prominent place in the annals of history.",,,
686,687,"In a phone call with Managing Director of the IMF yesterday, I told her about the government's resolve to complete the terms of IMF's program. I also explained Pakistan's economic difficulties especially after the devastating floods. IMF delegation will come to Pakistan soon.",,,
687,688,Just returned from Peshawar. The sheer scale of the human tragedy is unimaginable. This is no less than an attack on Pakistan. The nation is overwhelmed by a deep sense of grief. I have no doubt terrorism is our foremost national security challenge.,,,
688,689,World should take note of Indian govt's mistreatment of political prisoners in IIOJK. Conviction of prominent Kashmiri leader Yasin Malik on fake terrorism charges is futile effort 2 silence voices critical of India's blatant human rights abuses. Modi regime must b held 2 account,,,
689,690,أتقدم بأحر التعازي، وخالص المواساة لحكومة وشعب سوريا الذين عانوا خسائر بشرية ومادية جسيمة جراء الزلزال الكارثي في وقت مبكر من صباح اليوم.,,,
690,691,Deeply saddened to learn about the passing of Pope Emeritus Benedict XVI. He would be mourned by millions around the world including in Pakistan. May his soul rest in eternal peace.,,,
691,692,"Merry Christmas to the Christian community around the world & particularly our Pakistani Christian brothers & sisters. Jesus Christ's teachings of love, brotherhood & peace are beacon of light for us. On this Day, let us all renew our pledge to work for peace & prosperity for all",,,
692,693,The Punjab Chief Minister and his team deserve praise for restoring the solid waste management system that was destroyed during the previous regime in Punjab and for making good arrangements for the disposal of waste and waste and sanitation after many years. I sincerely hope that this standard will be maintained on a permanent basis.,,,
693,694,"Hükümetimiz, Türkiye için devam eden kurtarma ve yardım çalışmalarını ülke çapında bir kampanyaya dönüştürmeye karar vermiştir. İş dünyasının, din alimlerinin ve eğitim kurumlarının desteğini alacağız. Pakistan bu zor anlarında Türkiye'nin yanında olmaya devam edecektir.",,,
694,695,"Dear brother 
@presidentaz
, we are saddened on hearing news of the loss of more than 70 Azerbaijani servicemen in unprovoked attack by Armenia. The people of Pakistan stand in solidarity with their brethren & support Azerbaijan’s right to defend its territorial integrity.",,,
695,696,My argument at the COP event was that the world needed to continue with a win-win approach to deliver on the landmark development. Transitional Committee has its plate full with time running out fast. We have to build on the hope by resetting our priorities for a bright future.,,,
696,697,"Türkiye'deki trafik kazasında ölen ve yaralanan birçokları hakkındaki haberler bizi üzdü. Pakistan hükümeti ve halkı adına, Cumhurbaşkanı 
@RTErdogan
 ve acılı ailelere yürekten başsağlığı dileklerimizi iletirim.  ",,,
697,698,"We may not have the real Mr Bean, but we have real cricketing spirit .. and we Pakistanis have a funny habit of bouncing back :)

Mr President: Congratulations. Your team played really well today. ",,,
698,699,"The supreme sacrifice rendered by Hazrat Imam Hussain (ra) & his family drew a distinct line between the forces of truth & falsehood, and the oppressor & the oppressed. The great Imam established a moral principle that has animated the struggles for right to self-determination.",,,
699,700,"Hakka yürüyen din alimi Şeyh Mahmud Efendi'nin vefatı sadece Türkiye için değil tüm İslam dünyası için büyük bir kayıptır. Takva, alçakgönüllülük gibi İslami ahlakı en iyi şekilde hayatında yaşadı. Efendi’nin sevenlerine, Türk milletine ve hükümetine en derin taziyelerimi sunarım",,,
700,701,What a game of football it was! Saudi Arabia made history today by staging the biggest upset in FIFA World Cup thriller against Argentina. Heartiest congratulations to HRH Crown Prince Mohammed Bin Salman. We share the happiness of our Saudi brothers & sisters on this great win.,,,
701,702,"Policemen who got martyred in Bolan, Balochistan, today are heroes of the nation. May their souls rest in peace! My heartfelt condolences & prayers are with the bereaved families.",,,
702,703,Unfortunate that Qatar is being subjected to a barrage of propaganda as host of FIFA World Cup. It should rather be commended for wonderful arrangements for mega event & being a promoter of global peace & development. Pakistan stands in solidarity with HH Emir & peole of Qatar ,,,
703,704,"Team Pakistan  

You have beaten all odds to reach the World Cup Final. I know you have the passion, motivation and determination to win. Believe in yourself & play your best game. The entire nation stands behind you. 

Good luck",,,
704,705,"The federal cabinet has increased the fund allocated for immediate cash assistance of 25,000 per family for the flood affected families from 28 billion to 70 billion. This increase has been made in view of the widespread destruction of floods. These funds are being distributed through BISP.",,,
705,706,"First, Pakistan & Qatar have a clear vision of the future, one that offers new opportunities & avenues in a swiftly changing world. Second, there is a greater awareness of the need for upgrading the bilateral relations by making economic cooperation the pivot of bilateral ties.",,,
706,707,"Reliance on imported energy, which is about  $27 billion annually, is unsustainable. Government's focus on leveraging the indigenous & renewable sources of electricity will make the country self-reliant in terms of energy security & provide massive relief to the common man. 3/3",,,
707,708,"Nations derive their strength from the youth who power their journey & animate their future. This in turn requires investment in their development. Some power-hungry politicians have had no qualms about making them prey for their partisan agenda, which is unfortunate.",,,
708,709,"In the last four months, the entire nation has seen how Imran Niazi has used such epithets against the leadership of the Pakistan Army. His social media trolls have run hateful trends against the forces. Will the families of the martyrs forget all this?

Niazis can fool themselves, not the nation.",,,
709,710,"The social media campaign belittling & ridiculing the sacrifices of our martyrs was horrifying. This is what self-righteous political narratives do: they poison the minds of the youth & weaponise hate speech. Which way are we headed? 

The moment calls for a deep reflection.",,,
710,711,It is hoped that the Pakistani cricket team will fulfill the expectations of the fans in the future by maintaining the same excellent standard of the game.,,,
711,712,Islamabad ,,,
712,713,"I spoke to  Prime Minister @CMShehbaz today and welcomed 75 years of friendship between the UK and Pakistan.

I look forward to working together to strengthen trade, prosperity and international peace and security.",,,
713,714,"On World Environment Day today, the theme of #OnlyOneEarth is a clarion call for a united global action to address multifaceted challenge of climate change. It is critical that developing countries are provided with climate financing to fight environmental hazards.",,,
714,715,"The continued persecution of Hurriyat leader Yasin Malik by India is part of a plan to deprive Kashmiris of their representative voices. From fabricated cases to sham trial, impunity with which India is violating human rights of political workers should alarm rights defenders.",,,
715,716,"Happy Shab Barat to all the Muslims of the world. Let's all pray to the Lord today for the development and prosperity of our beloved country. I pray to the Lord Almighty to reduce the sufferings of the flood victims of Pakistan, the earthquake victims of Turkey and Syria and end the sufferings of the Muslim brothers and sisters of Kashmir and Palestine. Amen!",,,
716,717,"Agriculture is the backbone of our economy. I have formed 8 sub-committees for reforms in the agricultural sector. The government will ensure easy access to easy loans, quality seeds and pesticides to the farmers. We will take important decisions for the development of the agricultural sector in the coming days.",,,
717,718,Kashmir Martyrs' Day is a reminder of sacrifices Kashmiris have rendered for their inalienable & UN-sanctioned right to self-determination. The flame of freedom from the Indian yoke has been kept alive by the generations of Kashmiris in the face of Indian tyranny & oppression.,,,
718,719,BREAKING NEWS: Weightlifter Nooh Dastagir Butt wins GOLD MEDAL for Pakistan in commonwealth games with a record lift of 405kg.,,,
719,720,"Deeply indebted to the United Nations 
@UN
 for launching $160 million Flash Appeal for the flood victims in Pakistan. What Pakistan is facing today could not be put better than what UN Secretary General 
@antonioguterres
 described as ""awash in suffering"". The world should act now.",,,
720,721,"2022 was another difficult year for Pakistan. The worst floods have added to our economic woes. My new year resolution is to use my time and all my energies this year to alleviate the sufferings of the people of Pakistan, to rehabilitate the flood victims and to put Pakistan on the path of development and stability. will do",,,
721,722,My congratulations and best wishes to the Chairman Joint Chiefs of Staff Committee-designate Lt. General Sahir Shamshad Mirza and Chief of the Army Staff-designate Lt. General Asim Munir on their appointment.,,,
722,723,We need such unique projects in every sector to meet the challenges of a rapidly growing country's population. These mobile schools are capable of imparting education like any standard school at a low cost and the number will soon be increased from 8 buses to 16 buses. 2/2,,,
723,724,COAS Gen Qamar Javed Bajwa's address at Royal Military Academy Sandhurst UK as chief guest is not just a matter of honour for the armed forces but also for Pakistan. This is a recognition of the Pakistan-UK strategic partnership & the success of our armed forces in war on terror.,,,
724,725,I express my sincere sympathy to the people & government of Japan who are facing the ravages of Hurricane Nanmodal. Only goes to show that climate change does not follow a linear pattern & can bring disaster to any country. The world needs to wake up to horrors of this monster.,,,
725,726,"Congratulations to Team Pakistan   for a great series win. And what an amazing finish today with Nawaz, Haider & Harris playing significant role. All the best to Babar-11 for the upcoming T20 World Cup.",,,
726,727,"During his visit to the flood-affected areas & camps under scorching heat, UN Secrtary General was overwhelmed by the scale of devastation that has engulfed Pakisan. His voice has become the voice of flood victims. The world should pay heed to what he said about climate change.",,,
727,728,"My point was that international community, particularly the developed world, should not leave developing countries like Pakistan at the mercy of climate change. If it is us today, it can be somebody else tomorrow. Threat of climate change is real, potent & staring us in the face.",,,
728,729,I am deeply saddened and saddened by the death of 19 people when the bus going to Quetta fell into the canal. May Allah raise the ranks of the deceased. All my sympathies are with the bereaved. Instructions have been issued to provide the best and immediate medical facilities to the injured.,,,
729,730,"In my meeting with Mr. Duarte Pacheco, President of Inter-Parliamentary Union today, a representative body of 178 Parliaments, I underscored how fake news poses a threat to democracy. Together with fabrication, it can rob people of their democratic rights & violate human rights.",,,
730,731,Leaving for 2-day visit to Türkiye at the invitation of my brother H.E. President Tayyip Erdogan. Inauguration of third MILGEM Corvette Ship represents deepening of defence cooperation b/w our two brotherly countries. High level exchanges are a defining feaure of our partnership.,,,
731,732,"The people of 20 constituencies of Punjab are requested to come out of their homes with full enthusiasm, exercise their right to vote, your future depends on this slip. Elders, mothers and men and women should decide today that service will rule in Punjab and Pakistan, not incompetence, lies and corruption.",,,
732,733,"Just saw off a cargo plane carrying relief goods of 20-tonne for the earthquake victims of Turkiye. Pakistan  has established an air, land & sea bridge for the provision of relief assistance for our brothers & sisters in Syria  and Türkiye ",,,
733,734,I was set to visit the UAE on Sept 3 on the invitation of HH the President. We mutually decided to postpone the visit so that I could focus on the ongoing rescue & relief activities. We will forever be indebted to our brothers & sisters who have stood by us in this challenge.,,,
734,735,"I send my heartfelt condolences and most sincere sympathies to H.E. Pushpa Kamal Dahal Pranchanda 
@cmprachanda
 on the tragic crash of a passenger aircraft. Our thoughts and prayers are with the bereaved families & the people of Nepal ",,,
735,736,"The recent devastating floods destroyed millions of acres of ready crops. An agricultural country like Pakistan will also have to import food items to compensate for this loss. Today, World Food Day highlights the importance of overall global initiatives to ensure food security in different countries of the world. /1",,,
736,737,"Today, in keeping with the promise of our leader Mian Muhammad Nawaz Sharif with his fellow Pakistanis, the foundation stone of the 306 km long Sukkur-Hyderabad Motorway has been laid. Undoubtedly, the credit for the construction of motorways in Pakistan goes only to Quaid Mian Muhammad Nawaz Sharif.",,,
737,738,"Together we will overcome all the challenges with resolve and determination, InshaAllah! ",,,
738,739,There is no question of a cut in the budget of Higher Education Commission. I am aware of the negative effect that cuts have had on higher education during the past four years. I have given clear directions to Planning Commission & Ministry of Finance in this regard.,,,
