,Unnamed: 0,Tweets,Unnamed: 2,Unnamed: 3,Unnamed: 4
365,366,"I just had a telephone conversation with His Excellency President Tayyip Erdogan, I expressed my condolences and regret for the loss of life and property as a result of the earthquake in Turkey. I have told them that Pakistan stands side by side for all kinds of help to its Turkish brothers and sisters in this hour of difficulty.",,,
366,367,"My best wishes for newly elected Vice Chairman, Punjab Bar Council, Mr Basharat Ullah Khan and Chairman Executive Committee 
Mr Tahir Shabir.
Asma Jehangir Group has always stood firm for rule of law and strengthening democracy in the country. 1/2",,,
367,368,"Deeply saddened to learn about the passing away of former Prime Minister of Turkiye H.E. Binali Yildrim’s mother.  

May the departed soul rest in eternal peace! 

I extend my heartfelt condolences to brother Binali Yildrim 
@BY
 & his bereaved family on this irreparable loss.",,,
368,369,It could not get more gruesome than this. We are deeply shocked & hurt to learn about the killing of 3 dozen people including 23 children & infants in Thailand. Have no words to condemn this barbarity. We send our deepest condolences to the bereaved parents & people of Thailand.,,,
369,370,"The nation pays its rich tributes to Kargil war hero Captain Karnal Sher Khan, Nishan-e-Haider, on his 23rd martyrdom anniversary. The mountains of Kargil may not have seen such an act of valour when he led his troops to clear a vital position as the enemy bullets rained.",,,
370,371,"Deeply indebted to His Highness the Aga Khan for contribution of $10 million for the flood victims in Pakistan. In a telephonic chat with Prince Rahim Aga Khan today, I requested His Highness to play his role in raising awareness about flood situation in international community.",,,
371,372,"I have written 2 letters to Chief Justice of  with a request to form judicial commission to investigate Arshad Sharif’s killing & attack on Imran. These unfortunate incidents are being used to make false allegations, spread chaos & undermine institutions. Let truth b determined",,,
372,373,"Following my directions to the federal & provincial authorities, emergency relief measures are underway for the residents of Dera Bugti. The situation is being monitored very closely. The federal government will extend its support & assistance to Balochistan.",,,
373,374,"At 5th UN Conference on Least Developed Countries, I cautioned against world's increasing indifference & fatigue to help the LDCs fight the pandemic of inequality, climate change & massive disruption in global supply lines. Motto 'Leaving no one behind' calls for a new awakening.",,,
374,375,"We send our deepest condolences & most sincere sympathies to 
@POTUS
 and the government & the people of the United States on the loss of precious lives & damages in the hurricane Ian. Our thoughts and prayers are with the bereaved families.",,,
375,376,"I think that millions of brothers and sisters who are living below the poverty line are facing serious difficulties due to inflation. In such a situation, the arrival of Ramadan gives us the privilege to go ahead and provide relief to the suffering of the poorest section of our society. 1/2",,,
376,377,Congratulations to our Finance & Foreign Office teams led ably by Ministers Miftah Ismail & Bilawal Bhutto for their efforts in getting the IMF program revived. It was a great team work. The Agreement with the Fund has set the stage to bring country out of economic difficulties.,,,
377,378,"May you be successful our Prime Minister 
Thank you Qatar for standing by Pakistan.",,,
378,379,Heart-wrenching news from Balochistan about martyrdom of 5 soldiers including an Army Captain. The nation pays its tributes & respects to our heroes who laid down their lives for Pakistan. The perpetrators of terrorism will be brought to justice. Let there be no mistake about it.,,,
379,380,"Budget represents a significant improvement in several ways. It has provided more educational opportunities for our youth, particularly from Balochistan & targeted subsidies for financially weaker people. More importantly, it has taxed non-productive assets of the rich.",,,
380,381,"In line with my commitment to ensure transparency, the Government of Pakistan has decided to conduct an audit of the Prime Minister's Flood Relief Fund by the Auditor General of Pakistan and a firm of international repute. Audit reports will be made available to the public",,,
381,382,"To the law enforcement agencies, doctors, paramedical staff, border guards, civil administration officials and the staff of the local bodies involved in cleaning during the sacrifice on Eid-ul-Adha for this spirit of self-sacrifice. The whole nation pays tribute.",,,
382,383,Hugely appreciate the police personnel who showed unprecedented courage & bravery in repulsing a terrorist attack on police station in Mianwali. Our police force along with the CTD have been the bulwark against terrorism. The whole nation remains in eternal gratitude to them.,,,
383,384,"Today I am going to announce a huge package for the revival of agriculture in the country, development and prosperity of the farmer brothers. I believe that only through the development of agriculture can the country face the challenges of food security.",,,
384,385,Punjab was subjected to the worst governance for the entire 4 years. Citizens were deprived of free medicines and students were deprived of scholarships. Government posts and transfers were openly bought and sold. The state of civic facilities deteriorated and lawlessness was on the rise. The condition of Punjab is no less than an insult to the people of Punjab,,,
385,386,"Happy Punjabi Culture Day to the people of Punjab, the land of lush green fields. The beauty of the rainbow of the Federation of Pakistan is incomplete without the desert of Cholistan, the land of saints Multan, the wrestlers of Gujranwala, the talented people of Faisalabad, the brave men of Potohar and the living heart of Lahore.",,,
386,387,"In addition to reviewing the whole spectrum of bilateral relations, President Erdogan & I discussed ways and means to achieve the target of increasing trade volume to $5 billion in 3 years. We vowed to ensure effective implementation of Trade in Goods Agreement in this regard.",,,
387,388,Our great friend China has always stood by Pakistan through thick & thin. We are highly grateful to Chinese leadership for a pledge of $1 billion by Asian Infrastructure Investment Bank & $100 million separately @ Resilient Pakistan. This support is crucial for reconstruction,,,
388,389,"We will place comprehensive post-disaster framework plan for recovery, rehabilitation & reconstruction with resilience before development partners & friendly countries. Bridging funding gap is key to restore critical infrastructure, rebuild lives & livelihoods & revive economy /2",,,
389,390,"While casting your vote in the by-elections of Punjab, you will surely think about the corruption, incompetence, economic destruction, facilitation and patronage of the mafia and the destruction created in the name of change during the 4 years of the dark era of the Imran Niazi government. Pakistan has moved away from its destination under PTI, you have to express it with your vote",,,
390,391,"Today by inaugurating the unique project of School on Wheels consisting of 8 buses, I started the process of providing free and quality education to the children of middle and low income families in and around Islamabad at their doorsteps. Is. 1/2",,,
391,392,"I appreciate the dedication & commitment of the law enforcement agencies, police & civil administration under the leadership of Interior Minister Rana Sanaullah for excellent law & order arrangements. We owe them our collective gratitude for displaying amazing sense of duty.",,,
392,393,This man Niazi is stooping to unprecedented lows in his desperation for power & going to the extent of damaging the country & undermining our armed forces & their leadership. /2,,,
393,394,"Inauguration of Green & Blue Lines of Metro Bus Service is great news for citizens of Islamabad & surrounding areas. It’s part of our efforts to provide efficient & comfortable public transport system. It will address problems of traffic load, fuel cost & environmental hazards.",,,
394,395,"Brotherly UAE has started delivering the first tranche of relief good worth $50 million for the flood victims in Pakistan. In my telephonic conversation with my brother HH President 
@MohamedBinZayed
last night, he assured the UAE will continue to help flood affectees.",,,
395,396,Gone are the days when climate change was the subject of drawing room discussions. It is affecting our everyday life. Food & water security is directly linked to climate hazards. We are determined to take on this challenge to shape a healthy & meaningful future for our children.,,,
396,397,The heart is deeply saddened and saddened by the martyrdom of 6 military personnel including 2 pilots in the accident of Pakistan army helicopter in Harnai Balochistan. We pray to Allah Almighty to give the martyrs a place in Jannat al-Firdous and give patience to their families. . The entire nation shares the grief of the bereaved families.,,,
397,398,New Afghan visa policy by our govt is part of our efforts to continue helping our Afghan brothers & sisters in their hour of need. Grant of transit visa will help them complete paperwork for onward travel. International community should also lend a helping hand to people of ,,,
398,399,Societies whose foundations are built on human rights prosper faster than others.Present global tumult is explained by denial of fundamental rights to oppressed people such as Kashmiris in IIOJK & Palestinians. The world needs to renew its political will on Human Rights Day today,,,
399,400,"I extend my profound condolences on the sad demise of former President of China, Jiang Zemin. 
Late President was a wise leader and a statesman. In Pakistan, we fondly remember him as a great friend who made valuable contributions in strengthening Pakistan-China relations.",,,
400,401,Great meeting with H.E. President Ilham Aliyev on the sidelines of CICA Summit. We built on our discussions during SCO last month. Grateful to the President for his offer of support to help Pakistan meet the need for urea in view of challenges during coming sowing season.  ,,,
401,402,"I will meet all these athletes on their return home and encourage them. Apart from this, other Pakistani athletes participating in the Commonwealth Games are also commendable who are representing Pakistan with hard work and dedication. Wins and losses are part of the game, don't give up, keep working hard.",,,
402,403,"The same is the case with Gawadar Airport and Gwadar Port. Due to the lack of dredging at the port, no large cargo ships can anchor. I have issued instructions to complete the immediate construction of Gwadar University, Airport and desalination plant for water.",,,
403,404,"Finalised Ramzan package today prepared by the Punjab govt on my directions. Under this package, the poorest of the poor will be given flour free of cost. Federal government will work with other provinces to launch similar schemes for the benefit of people affected by inflation.",,,
404,405,"Visited the British High Commission yesterday to offer my condolences on the passing of Her Majesty the Queen. I wrote in condolatory book that the Queen represented continuity, stability & predictability in the face of monumental changes for the UK and Commonwealth nations.",,,
405,406,> We also discussed ways & means to further strengthen our bilateral relationship in all areas.,,,
406,407,Leaving for Kazakhstan  today to attend the 6th Summit of the Conference on Interaction and Confidence Building Measures in Asia (CICA). I believe CICA is capable of shaping a new configuration of economic cooperation & security in Asia through greater connectivity.,,,
407,408,"I want to commend Dr Miftah Ismail for his public service as finance minister. Taking up one of the toughest jobs at the height of economic crisis, he led the effort to save Pakistan from default & successfully negotiated the IMF programme. I have the highest respect for the …",,,
408,409,"At CICA Summit, I explained how India uses the mantra of democracy to hide its gross human rights abuses. The world should recognise brutal nature of Indian policies in IIOJK. The terrorised valley of Kashmir is manifestation of bullet being a preferred Indian policy than ballot.",,,
409,410,"As we celebrate IWD today, it is enterprising young girls such as Ayisha Siddiqa, human rights & climate defender & poet, who are blazing the trail for us by using their talent to make the world a better place. These girls represent hope & a promise of bright future.",,,
410,411,Congratulations to Saudi Arabia for winning this tournament and proud of our Women’s National Team  finishing 2nd. Special congratulations to Maria Khan for scoring this spectacular goal. We are working on policy to promote football and women’s sports in Pakistan,,,
411,412,"The edifice of lies, slander & character assassination has come crumbling down today. Maryam Nawaz's acquittal in the Avenfield Reference is a slap in the face of so-called accountability system that was employed to target Sharif family. My congratulations to Maryam Beti & Safdar",,,
412,413,Congratulations to the Pakistan Hockey Team for their thrilling 5-3 victory over Japan and the bronze medal in the Sultan Azlan Shah Cup. Nation is proud of you. May this good news from the hockey field be blessed to the whole nation.,,,
413,414,"Prevalence of child labour means that all the material progress the world has made remains meaningless unless it can deliver a bright, secure & fulfilling future to children. Doing so is not just economic necessity but also a moral imperative, one that is at core of our humanity.",,,
414,415,Imran Niazi is playing a dangerous game. He is using tragic killing of Arshad Sharif for petty politics & going to the extent of casting aspersions on state institutions. He should be patient & wait for findings of Judicial Commission instead of resorting to baseless allegations.,,,
415,416,"The establishment of Pakistan was a miracle & one of the biggest developments of the 20th century, which was made possible under the dynamic leadership of the Quaid-i-Azam & the sacrifices of Muslims. The odds were certainly heavy but the will to defeat them was stronger.",,,
416,417,"PAF pilot Rashid Minhas, youngest recipient of Nishan-i-Haider, laid down his life in the line of duty this day 51 years ago. His was an act of valour & courage that symbolises selfless commitment of our Air Force officers to Motherland. He will always live in our nation's heart.",,,
417,418,"Thank you to Karachi's business community for the invitation to speak. I explained the rationale behind the ban on import of luxury items: saving scarce foreign exchange, dollar stabilization, ending social imbalance & strengthening local industry.",,,
418,419,It has been my conviction that Pakistan will progress only through sheer hard work. Politics of dharna is detrimental to progress & stability. We are focused on overcoming challenges of governance. Nothing can distract us from the task at hand. I owe it to people of Pakistan ,,,
419,420,"Today, on the occasion of Pakistan Defense Day, the nation salutes its martyrs and ghazis who sacrificed their lives to protect the motherland against Indian aggression. The armed forces and the nation united to crush the Indian war frenzy against its geographical integrity.",,,
420,421,"Went through this fascinating work of Faizan on my way to Islamabad. He has beautifully captured the stories of the citizens using Lahore Metro for their daily commute. 

“Thak ta nai gy ho? Datta sahib any wala hai.” — it really touched my heart!",,,
421,422,"Noah Butt and Arshad Nadeem won gold, Sharif Tahir, Zaman Anwar and Inam Butt won silver, Shah Hussain, Ali Asad and Inayatullah won bronze medals in the Commonwealth Games, making all Pakistanis, including me, proud and the United Nations. What has increased the respect of Pakistan in the world? You are the pride of the whole nation.",,,
422,423,My decision to ban import of luxury items will save the country precious foreign exchange. We will practice austerity & financially stronger people must lead in this effort so that the less privileged among us do not have to bear this burden inflicted on them by the PTI govt.,,,
423,424,Government has decided to tax non-productive assets of the rich including 5% tax on purchase of second property & increase in tax on luxury cars.,,,
424,425,"I spoke with a team of Financial Times 
@FT
 a couple of days ago. 

Here is the link to my interview:",,,
425,426,"I was briefed about the key solar energy initiatives earlier today. Coalition govt will soon introduce the country's first comprehensive solar policy after approval of the CCI. Solar energy will drastically cut fuel imports, bring down cost of electricity & provide clean energy.",,,
426,427,"A nail-biting finish to the 8th edition of Pakistan Super League. My appreciation is due to Chairman PCB, CMs of Sindh & Punjab, provincial administrations, police & the participating teams for making the event a huge success. Spectators kept it animated with their energy & zeal.",,,
427,428,"Heartiest felicitations to Rt Hon’ble Pushpa Kamal Dahal Prachanda on becoming Prime Minister of Nepal. As regional partners, Pakistan & Nepal enjoy cordial relations. I look forward to working with him to further strengthen our bilateral ties & regional cooperation. 
@cmprachanda",,,
428,429,لا يمكن لشعب باكستان أن ينسى كيف تقدمت تركيا لمساعدتنا آن زلزال عام ٢٠٠٥م، وكذلك فيضانات عام ٢٠١٠م، إذ إن المفهوم الإسلامي للأخوة يربطنا بعلاقة مميزة فريدة حيث نتقاسم آلام بعضنا بعضا.,,,
429,430,It was great meeting with Crown Prince Mohammed bin Salman. We reaffirmed our commitment to taking Pakistan-Saudi ties to a new & higher level. I admired his visionary leadership & thanked him for according us a warm welcome & for always standing with Pakistan. We also discussed>,,,
430,431,"People of Pakisan join me in greeting our brothers & sisters of UAE  on their National Day today. The Day is a reminder of the dynamic vision of its founding fathers who laid the foundation of a great nation through unification. Congratulations to my brother HH 
@MohamedBinZayed",,,
431,432,"The meeting reviewed the security landscape & agreed to adopt a uniform policy between the federation & provinces. It considered proposals for revision of NAP & approved a slew of measures to improve investigation, forensic & working of CTD. 2/3",,,
432,433,"Being in Turkey feels like being home, overwhelmed by the warmth of our Turkish brothers & sisters. Our bilateral ties have entered a new era of strategic partnership under the leadership of President Erdogan. We are on course to unpack the full untapped potential of relationship",,,
433,434,"The same holds true for Gwadar seaport & construction of Gwadar airport. No dredging was carried out at seaport & thus no large cargo ship can be anchored. Have ordered quick completion of Gwadar University, airport & installation of desalination plant for clean drinking water.",,,
434,435,"On the second day of the meeting of the United Nations General Assembly, in a conversation with the high-level leadership of the IMF and the World Bank, I talked about having resources for reconstruction after the flood in the recent program. In meetings with other world leaders, we discussed climate change, rehabilitation of flood victims",,,
435,436,"With full determination and faith, we all will defeat all kinds of difficulties together. God willing!",,,
436,437,Imran Niazi's baseless & dangerous allegations against former President Asif Ali Zardari are not only irresponsible but also conform to a pattern of conspiracy theories meant to spread venom against his political opponents. /1,,,
437,438,"I thank all the friendly countries for their condolences & profound sympathies on the loss of precious lives in Peshawar tragedy. We deeply value this show of solidarity at this difficult time. With support of our people, we will crush terrorists & eliminate them from our soil.",,,
438,439,"The core of my argument during my speech at NA was that for a democratic system to work smoothly & effectively, it is important that all state organs act within the domains stipulated by Constitution. Without understanding this, we will be moving in a circle, getting nowhere.",,,
439,440,"Kashmir's Accession to Pakistan Day is a reflection of Kashmiris' pledge to continue their struggle till the idea of accession becomes a reality. Indian oppressive state apparatus has failed to stop this journey of resistance, sacrifice & defiance. We salute Kashmiris' courage.",,,
440,441,"Today I am embarking on a visit to Saudi Arabia to renew & reaffirm our bonds of brotherhood & friendship. I will have wide-ranging discussions with Saudi leadership. KSA is one of our greatest friends & as Custodian of the Two Holy Places, has a special place in all our hearts.",,,
441,442,"Imam Hussain (RA) is the voice of the poor, unity, brotherhood, high morals and truth. The message of resistance and standing firm for their rights will continue to encourage the entire humanity to establish a moral system based on the golden principles of equality and freedom.",,,
442,443,"After 68 years from tomorrow, the great words and instruments of our national anthem are going to become the voice of the nation in a new way. I dedicate this beautiful presentation and these historical moments to the Pakistani nation. Kudos to the entire team including Ministry of Information, Steering Committee, ISPR. Pakistan Zindabad",,,
443,444,"From the first day, protecting the poorest class from the impact of difficult economic conditions has been our first priority. The announcement of the Chief Minister of Punjab to provide free electricity to families using up to 100 units per month is very welcome. As the economic conditions improve, we Will provide more facilities, God willing",,,
444,445,The coalition government is working diligently on Thar coal & solarization projects to generate electricity. This will substantially bring down the cost of electricity & provide relief to citizens. My appreciation for Sindh government & other stakeholders.,,,
445,446,"What a nail biting finish to the FIFA WC  … Messi’s  

Congratulations to Qatar for successfully holding the mega event…Upsets by Saudi Arabia and Morocco remain highlights of the tournament for me.",,,
446,447,"At Islamabad Journalist Safety Forum today, I highlighted steps taken by the government to ensure media freedom. In Asia, Pakistan has performed very well on the UN Plan of Action. I shared the resolve to fully implement the Protection of Journalists & Media Professionals Act.",,,
447,448,Pakistan’s accession to Apostille Convention will facilitate & ease a significant burden on Pakistanis traveling & living abroad. Creating smooth processes for our citizens is a priority for us. Now Pakistani notarized documents will be accepted in 100+ countries.,,,
448,449,"د شمالي وزیرستان خلک د دھشتګردانو په لاس د ډیری مودې راهیسې ځپل شوي دي.

نن مې شمالي وزیرستان ته د خپل سفر په مهال یو پوهنتون، د دانش سکول سیسټم او میډیکل کالج تعمیرولو اعلان وکړو. دی سره یو موبائل ہسپتال به زر ته شمالی وزیرستان تہ اولاړ شی",,,
449,450,"Consistency and hard work are ingredients for success.

Congratulations to our Women's cricket team for beating the archrivals in a T20 match today. Well played. 

Pakistan  is proud of you.",,,
450,451,The Agreement to protect a third of the planet by 2030 reached at COP15 UN Biodiversity Summit is truly nothing short of being historic. Protecting our biodiversity is key to putting nature on a path to recovery. It reflects humanity's collective resolve to protect Mother Earth.,,,
451,452,"Thank you Prime Minister. It was great speaking to you about a range of issues that define our excellent bilateral relations. My government is keen to further deepen ties with the UK through renewed cooperation in areas like trade, commerce, culture, investment & energy.  ",,,
452,453,"I inaugurated the 7th nuclear power plant of Pakistan & 3rd nuclear power plant built in Karachi yesterday. With the induction of K-3, the total nuclear power generation capacity has reached 3600 MW. The K-3 project has added a total of 1100 MW electricity to the national grid.",,,
453,454,I extend my warm congratulations to H.E. Mr. Li Qiang on his election as new Premier of . Look forward to working closely with him to further advancing Pakistan-China Strategic Cooperative Partnership. I am confident our bilateral relations will enter a new era of cooperation.,,,
454,455,"Grateful for President 
@EmmanuelMacron
’s message of support for the people of  faced with devastating floods. We appreciate France’s solidarity and offer of help for the affected people in this hour of need.",,,
455,456,"الهدف من زيارتي إلى الإمارات العربية المتحدة هو البناء على المحادثة التي أجريتها مع صاحب السمو الشيخ 
@MohamedBinZayed
 نتشارك العزيمة والتفاهم على ضرورة بذل الجهود الدؤوبة لتعزيز العلاقات التجارية، والاستثمارية، والاقتصادية.",,,
