,Unnamed: 0,Tweets,Unnamed: 2,Unnamed: 3,Unnamed: 4
182,183,بمناسبة تعيينه رئيساً لمجلس وزراء المملكة العربية السعودية، أبارك لأخي ولي العهد الأمير محمد بن سلمان بن عبدالعزيز آل سعود، وأدعو لسموه بالتوفيق والسداد وللمملكة العربية السعودية الشقيقة بمزيد من التقدم والازدهار في ظل قيادة خادم الحرمين الشريفين الملك سلمان بن عبدالعزيز آل سعود.,,,
183,184,"Today, the nation needs to adhere to the eternal golden principles of faith, unity and organization of the fathers of the nation in order to cope with the challenges facing Pakistan. The dear country, surrounded by economic problems, is facing the natural calamity of floods.",,,
184,185,I offer my condolences to the family of General (rtd) Pervez Musharraf. May the departed soul rest in peace!,,,
185,186,The highly offensive desecration of the Holy Quran by a Danish politician is the third such incident in a row that should be strongly condemned by the civilised world. The need for global unity to fight Islamophobia couldn't be more urgent than it is now. We are deeply hurt.,,,
186,187,"Türkiye'nin 99. Cumhuriyet Bayramı'nda Cumhurbaşkanı 
@RTErdogan
'a ve Türk milletine en içten selamlarımızı gönderiyorum. Gazi Mustafa Kemal Atatürk'ün önderliğinde Türk milletinin kahramanca yürüttüğü bağımsızlık mücadelesi tarihin kayıtlarında önemli bir yere sahiptir.",,,
187,188,"Thank you Secretary General 
@antonioguterres
 for your strong advocacy of the plight of flood victims & drawing world's attention to the most urgent actionable issue of climate change. International community should move away from talking about climate to acting together. #UNGA",,,
188,189,It is important to engage our people in the parliamentary proceedings. They should know how parliament works and what their representatives are doing.,,,
189,190,Avenfield Reference highlights how system of accountability was used to discredit & defame Mian Nawaz Sharif & Maryam Nawaz.Such a vendetta-driven process led to disruption of the country's democratic evolution & caused political instability that took a terrible toll on politics.,,,
190,191,"Your vote is power. Use this power to reject the politics of anarchy, division & hate. Our beautiful country is much more than what this man has reduced it to. Cast your vote for national development & bright future of your children. I have my faith in your power to choose.",,,
191,192,"Pakistan fell 12 points on Press Freedom Index during last year of Imran Khan's govt & 18 points during his tenure. It not only earned him shameful title of ""press freedom predator"" but also placed our democracy in bad light. We are fully committed to freedom of press & speech!",,,
192,193,"As the world faces the prospect of a recession fuelled by increase in the energy & food prices, there is a greater need to promote engagement & understanding to form win-win partnerships. Climate induced disasters call for synergized efforts for mutually beneficial outcomes.",,,
193,194,"A massive national effort is underway to restore essential services in the flood-hit areas. NHA, DISCOs, PTA & other federal departments have done amazing work against the heaviest of odds & largely rehabiliated the damaged infrastructure. My appreciation for all public servants.",,,
194,195,"Presenting Pakistan's case at both the international forums was the result of excellent team work. I particularly appreciate Foreign Minister Bilawal Bhutto, Minister for Information Marriyum Aurangzeb & Minister for Climate Change Sherry Rehman for their hard work & assistance.",,,
195,196,"Congratulations to Federal Minister for Finance 
@MiftahIsmail
 & his entire team on the presentation of a balanced, progressive and pro-people budget. Making a budget in financially challenging times with so many constraints is no less than a herculean task.",,,
196,197,It is my pleasure to extend heartiest felicitations & greetings to the people & government of the United States on their Independence Day. My govt looks forward to engaging with the Biden Administration at all levels to promote our bilateral relations including trade & investment,,,
197,198,"Highly grateful to UN Secretary General H.E. 
@antonioguterres
 for his unwavering support to Pakistan's flood victims & raising his voice for recovery & reconstruction of  with resilience. He played a pivotal role in making Resilient Pakistan Conference a resounding success.",,,
198,199,لقاء مثمر جمعني بصاحب السمو الملكي الأمير محمد بن سلمان، اتفقنا على رفع مستوى العلاقات الثنائية والروابط الأخوية بين باكستان والمملكة العربية السعودية والأخذ بها إلى آفاق جديدة وفق متطلبات العالم المتغير بصورة مستمرة، وأخبرت صاحب السمو الملكي أن شعب باكستان يتطلع بشغف إلى زيارته.,,,
199,200,"Honoured to host our players & athletes who made the country proud by winning various medals in the Commonwealth Games. Their hard work & devotion was exemplary. Today I also announced the revival of the departmental sports, which was a long-standing demand.",,,
200,201,"Today, while meeting the flood victims of Khyber Pakhtunkhwa, I assured them of the government's full cooperation in their rehabilitation. Belonging to any political party or region, rehabilitation and service to flood victims is our national mission. Pakistan is our country which we have to serve together. God willing",,,
201,202,"Deeply grieved at the passing of Her Majesty Queen Elizabeth II. Pakistan joins the UK & other Commonwealth nations in mourning her death. My heartfelt condolences to the Royal Family, people & government of the UK. 
@10DowningStreet
 @RoyalFamily",,,
202,203,"Deeply grieved at passing of prominent Kashmiri leader Altaf Shah, son-in-law of Syed Ali Geelani, while in Indian captivity. Modi regime denied him treatment despite knowing he was cancer patient. Custodial killings are norm in Modi's India. My condolences to the bereaved family",,,
203,204,"The 27th of October is observed as Black Day when India illegally, immorally & forcibly occupied Jammu & Kashmir in 1947. This Day is a testament to Kashmiris' legendary courage & resilience they have shown in standing up to the Indian occupation forces over the last 75 years. /1",,,
204,205,"In my address at Resilient Pakistan Conference, I outlined recovery, rehabilitation & reconstruction needs of Pakistan over medium to long terms. I explained how flood ravages have caused learning, health & infrastructure losses. I alerted world to spectre of food insecurity.",,,
205,206,"I direct the Muslim League (N) workers to donate blood to save the lives of those injured in the suicide attack, especially the people with 'O-Negative' blood, students and party workers are appealed to immediately. Reach Lady Reading Hospital, Peshawar and contribute to saving precious human lives.",,,
206,207,"Today we acknowledge, applaud & pay tribute to our women for their heroic struggle & incredible contribution to society. The odds could not have been heavier but their resolve to navigate through them is what gives us hope in the future..

 1/2",,,
207,208,"In the following tweets, I explain the rationale behind the announcement of 10% super tax on the affluent people.",,,
208,209,"Yesterday ISI Officer Naveed Sadiq came to pay homage to the family of Shaheed on behalf of himself and the nation. Of course, it is thanks to the martyrs of the country like Naveed Sadiq and Nasir Abbas Shaheed that the nefarious intentions of elements hostile to Pakistan were crushed. The nation will always be grateful to its martyrs and their families",,,
209,210,"Highly grateful to H.E. President Xi Jinping  for Chinese assistance package of RMB 400 million, up from initial RMB 100 million, for flood victims in Pakistan. This is a reflection of our unique bond of friendship. This support will help provide much needed relief to the people.",,,
210,211,"Polio is a deadly virus that threatens not just life but also the future of our children. It is regrettable that we have not fully eliminated it so far. Polio campaign starting today aims to target 25 most vulnerable districts. Let us make it a success& defeat polio, once for all",,,
211,212,"The investigation report of the reliable international organization Financial Times is a serious indictment against Imran Niazi, which has exposed the facts of foreign funding of PTI, remittance of illegal huge amounts. The concrete facts stated in the report are telling that Imran Niazi is a figure of lies, contradictions and hypocrisy.",,,
212,213,"According to my promise to the people, the coalition government has immediately transferred the benefits of the reduction in oil prices in the world market to the people. I believe in always speaking the truth to people.",,,
213,214,#COP27 being held in Egypt can be a watershed in humanity's fight against climate change & global warming. Extreme climatic events in Pakistan & Horn of Africa this year have showcased globalisation of climate change. Turning a blind eye to its lethal effects will be criminal.1/3,,,
214,215,The whole nation comes together today in paying homage to our martyrs & Ghazis who put their lives on the line to defend the motherland against the Indian aggression. Together our armed forces & people thwarted the Indian machinations to undermine our territorial integrity.,,,
215,216,Our government stands firmly behind Roshan Digital Account scheme. Happy that yesterday State Bank received $57 million the largest inflow in a day ever. We have now crossed $4.5 billion in total deposits. I thank overseas Pakistanis for reposing their trust in the motherland.,,,
216,217,"I extend my profound gratitude to His Excellency Syed Ebrahim Raisi, President of Islamic Republic of Iran  , for his message of support and solidarity to the government and people of Pakistan . We gratefully acknowledge his offer of support at this difficult hour.",,,
217,218,"It is important to understand the context of this visit. After the corona epidemic, the world is moving from economic slowdown to recovery. Geopolitical tensions have affected supply and demand and rising energy and food prices have added to the problems. Common challenges require finding new ways to collaborate.",,,
218,219,Deeply grieved over martyrdom of Lt Col Laiq Baig Mirza in Balochistan. Our law enforcement agencies will hunt down all those who perpetrated this heinous crime & bring them to justice. My thoughts & prayers are with bereaved family. Nation grieves with them & shares their sorrow,,,
219,220,Terrorists want to spread fear and panic among people through heinous acts and nullify our achievements of great sacrifices against terrorism and extremism. My message to all political forces is to unite against the enemies of Pakistan. We will fight our political quarrels later.,,,
220,221,"True public service is serving the people and making their lives easy

Well done, Saad Rafique ",,,
221,222,"At Asia-Pacific ICT Awards, I made a case for digital empowerment of our youth. In an age defined by technological disruption, our youth needs to focus on big  ideas. Our current IT exports have a potential of billions of dollars. Govt is taking steps to enhance our exports.",,,
222,223,Mir Balakh Sher Mazari was a veteran Baloch politician who played leading role in the country's politics. Our national politics is poorer with his death. He belonged to a breed of public servants who believe in values & principles. My heartfelt condolences to his family & friends,,,
223,224,"#COP27 needs to recognize the loss and damage experienced by Pakistan and it needs to define a clear roadmap to deal with it, 
@antonioguterres
 said today in a joint press encounter with 
@CMShehbaz
. 
https://un.org/sg/en/content/sg/press-encounter/2022-11-07/un-secretary-generals-remarks-joint-press-encounter-prime-minister-of-pakistan-shehbaz-sharif…",,,
224,225,"I urged the world to wake up to the defining challenge of climate change in terms of translating commitments into real-life outcomes. This calls for a transformational shift in flow of capacities, finances and technology to deal a decisive blow to the challenge of climate change.",,,
225,226,Saddened and saddened by the loss of 19 precious lives as a result of the boat capsizing accident in the Indus River near Rahim Yar Khan. We pray to Allah Almighty to grant the deceased a place in His mercy and grant patience to the affected families.,,,
226,227,"Keeping in mind our resources, all of us Pakistanis have to ensure energy saving and effective and efficient use. Today, the government has started the implementation of the energy saving plan with detailed consultation. We have to change our behavior in every sphere of life to make the energy saving plan successful.",,,
227,228,". Give a clear verdict against those who lie, take away the facility of 100 units of free electricity.",,,
228,229,"During my recent visit to Gwadar, I realized how the PTI government has harmed the people of Gwadar. Besides wasting billions of rupees and precious time, the previous government failed to complete a single project for electricity/water for the local people of Gwadar who sacrificed for the construction of the port.",,,
229,230,"Government has taken this decision for the purpose of poverty alleviation. We have asked our affluent segment of society to fulfil the national duty by sharing the burden, for it is the poor who have always borne the brunt & rendered sacrifices for the country.",,,
230,231,"I thank H.E. Mr. 
@alexanderdecroo
, Prime Minister of Belgium , for sending humanitarian assistance to support the flood victims in Pakistan. At the moment, Pakistanis are fighting one of the world gravest natural calamities & need the international community to stand by them.",,,
231,232,This is the first budget that contains the plan for revival of the economy. The hard decisions we have taken will enable the country to overcome the economic crisis. The government has tried its best to place minimum burden on lower income & salaried class.,,,
232,233,My discussions with Chinese leadership will focus on revitalization of CPEC among many other things. 2nd phase of CPEC promises to usher in a new era of socio-economic progress that will uplift quality of our people's lives. There is a lot to learn from Chinese economic miracle.,,,
233,234,"In my speech at CHS-SCO today in Samarkand, I asked member countries to renew their search for regional solutions to problems that threaten to undermine our shared peace & development. Building a wall against climate change is one such imperative that we ignore at our own peril.",,,
234,235,"Today, on the occasion of Navy Day, the entire nation pays tribute to the sacrifices made by the Pakistan Navy to protect the maritime borders of Pakistan. The Indian port of Dwarka was captured during the Ghazi Submarine War.",,,
235,236,"When the coalition government got into power, it had 2 paths open to it; whether to go for elections & leave the economy broken or address the economic challenges first. We opted to save Pakistan from economic quagmire even if it involved political risks. We put Pakistan first.",,,
236,237,"Special thanks to our agiculturalists, captains of commerce, trade and industry, IT and finance experts for their active participation & proposals. Pre-budget Business Conference was perfect platform for a candid exchange of views on the economic challenges & the way forward. ",,,
237,238,"I extend my congratulations to H.E. Luiz Inácio Lula da Silva 
@LulaOficial
 on his election as President of Brazil. I wish him great success & look forward to working with him to enhance bilateral relations b/wour two countries. We share consensus on the dangers of climate change.",,,
238,239,"We have reached out to donors, friendly countries & international financial institutions for assistance to respond to the scale of flood calamity. I will be meeting Islamabad-based ambassadors & high commissioners tomorrow to apprise them of nature of challenge & need for help.",,,
239,240,"There was deep sorrow and grief over the martyrdom of 9 army men in a car accident in Bagh. We pray to Allah Almighty to raise the ranks of the martyrs and give the bereaved patience. The entire nation, including the young men who laid down their lives for the sake of the country's survival and their brave families, pays homage to me.",,,
240,241,"Alhamdulillah!
Pakistan has got great success in the Geneva conference with the prayers of the nation.",,,
241,242,"Today, the Sikh community around the world, including Pakistan, is celebrating the 553rd birth anniversary of Baba Guru Nanak Dev. Baba Guru Nanak's life and his teachings teach brotherhood and peace. I welcome the Sikh pilgrims from all over the world on this holy day and hope that Pakistan I will have a great stay",,,
242,243,"Heartiest felicitations to H.E. 
@azpresident
 Ilham & brotherly people of Azerbaijan on their ‘Victory Day’, which signifies resilience, courage & national cohesion. May the commemoration of this Day usher in an era of lasting peace and prosperity in the Caucasus region.  ",,,
243,244,"The constitution has delegated state powers to parliament, administration and judiciary. The constitution has mandated all the institutions to work within the specified limits. No institution can interfere with the authority of another. There will be no compromise on the supremacy of the Constitution and Parliament.",,,
244,245,"On behalf of people & govt of Pakistan, I wish to extend our felicitations to King Salman bin Abdulaziz, HRH Crown Prince Mohammed bin Salman & people of Saudi Arabia on their Founding Day. The Day celebrates KSA’s rich history & culture & highlights its remarkable transformation",,,
245,246,"Grateful for Czech Republic PM 
@P_fiala
's message of support for the flood-stricken people of Pakistan. We appreciate  solidarity in this difficult time and look forward to support at the European Union .",,,
246,247,Thank you to the European Union for its commitment of $97 million for Pakistan's flood-affectees. The multifaceted relations between Pakistan & EU have grown over the decades. EU continues to remain one of Pakistan's largest trading & development partners & export destination.,,,
247,248,"Hepatitis has been affecting the whole world including Pakistan for decades. Pledge on World Hepatitis Day that we will reduce this risk through screening, vaccination and preventive measures. For its complete elimination from Pakistan by 2030, provincial governments and all stakeholders should create public awareness about its symptoms and prevalence.",,,
248,249,"I am convinced more than ever before that development of Pakistan is linked with peace, stability & progress of Balochistan. The coalition govt aims to assist Balochistan by working with the provincial govt & local elders to chart the way forward.",,,
249,250,"During my visit to Quetta today, I listened to diverse opinions and views of all stakeholders. The path to development passes through the hearts & minds of people. Mere development will be meaningless if people's genuine grievances are not addressed.",,,
250,251,"I am greatly thankful to my brother His Highness Sheikh 
@MohamedBinZayed
 for his message of condolences on the loss of precious lives in the flash floods. His words of comfort & support mean a lot to us at this time monumental challenge. We acknowledge his offer of support.  ",,,
251,252,"Peace & development in South Asia are linked to resolution of Kashmir dispute. On Right to Self-determination Day today, I call upon global community to play its part in giving Kashmiris of IIOJK their legal right to decide their destiny. India must reverse its actions of Aug 5.",,,
252,253,"We salute the brave and dutiful sons of the nation who saved the lives of the sisters, brothers and children of Turkey during the earthquake disaster, working day and night with the spirit of humanity. A proud and heartwarming sight of Rescue 1122's team returning home after completing the rescue operation in Turkey.",,,
253,254,We are grateful to His Highness Crown Prince Mohammed Bin Salman for ordering relief goods for the flood victims in Pakistan. Pakistan and Saudi Arabia  are bound in a relationship of love. This assistance is a sign that we feel each othter's pain.,,,
254,255,"In light of the outcomes of the Pre-Budget Business Conference, I have decided to form various task forces consisting of experts & professionals belonging to IT, export, agriculture, finance sectors & food security to finalise the proposals for fast-paced implementation.",,,
255,256,Saddened by the news of the loss of precious lives & ravages caused by a cyclone in Bangladesh. I convey our deepest condolences & most sincere sympathies to the government and the people of Bangladesh. Our thoughts & prayers are with the bereaved families.,,,
256,257,"Thank you to Prime Minister Justin Trudeau 
@JustinTrudeau
 for his thoughts & sympathies on the loss of precious lives & unprecedented devastation in Pakistan. Canada has been a great friend & we are grateful that the Canadian govt is taking steps to support the flood victims.",,,
257,258,"Every year, 16th December reminds the whole nation of the pain and sorrow when the Dhashgurds narrated the atrocities in APS Peshawar. Even after years, it is sad that it is not forgotten. Today is the day to pay tribute to the martyrs of APS tragedy and share the grief of their families. The Pakistani nation will never forget the sacrifices of its martyrs.",,,
258,259,"Government has decided to expand the ongoing rescue & relief efforts for Türkiye into a countrywide campaign. We will enlist the support of business community, religious scholars & educational institutions. Pakistan will continue to stand by Türkiye in this difficult hour.",,,
259,260,"Pakistan thanks Angelina Jolie, a special UN envoy, and other unsung heroes for becoming the voice of millions of people whose lives & livelihoods have been destroyed by raging floodwaters. We will forever remember their empathy & compassion for suffering humanity.",,,
260,261,"On behalf of the people & government of Pakistan, I wish to convey our sincere good wishes to His Majesty King Charles III on his accession to the throne. May the people of the United Kingdom continue to prosper under his benevolent reign 
@RoyalFamily
 @ClarenceHouse",,,
261,262,"Mirchi Maa Quetta-Wati-Tar, Tab-Wahd-Man-Oud-Mardmani-Hyal-Lyka-Gosh-Dast-Ant.-Dimru-Kishk-Madam-Lis-Mahluk-Dil-Hyalani-Teha-Cha-Guzayat. Hishkeen Dimervi Hitchkar-Nayet Dan Mardamani Rastan Jeerhani Geshwari King Meh Bait.",,,
262,263,I urge the Election Commission of Pakistan to announce long-delayed judgment on PTI foreign funding case. For long has Imran Niazi been given a free pass despite his repeated & shameless attacks on state institutions. Impunity given to him has hurt the country.,,,
263,264,"India has unleashed its brute & oppressive state apparatus to browbeat Indian Muslims into submission. The whole plan is to further marginalise them politically, economically & culturally. The reality of India's ""democratic face"" is before the world to see.",,,
264,265,"The establishment of loss & damage fund at the UN climate summit is the first pivotal step towards the goal of climate justice. It is up to the transitional committee to build on the historic development. I appreciate 
@sherryrehman
 & her team for their contribution & hard work.",,,
265,266,"I have just been informed that Pakistani citizen Mudassar Sultan @Asmi_Malik_ has passed away in Saudi Arabia. May Allah grant him a place in Jannat al-Firdous and give patience to his family. He was a valuable asset of the party.
Instructions have been issued to the Pakistani embassy to bring his dead body to Pakistan",,,
266,267,Let us turn Pakistan  into a country where difference of opinion is not treated as an act of enmity, where criticism is faced with courage, where public service delivery is the definition of politics, where women are treated with respect & the rights of minorities are protected
267,268,"Your vote is your power. Reject the politics of chaos, hatred and division with this power. One person's ego, style of politics and incompetence have ruined the beauty of our society. Cast your vote for national development and bright future of your children. I have full faith in your power of choice.",,,
268,269,د خېبرپښتونخوا سېلاب ځپلو سيمو ته د خپل سفر په مهال، ما خلکو ته ډاډ ورکړ چې حکومت به تر هغه وخته پورې د دوی په خدمت کې حاضر وي تر څو چې دوی خپل کورونو تہ واپس نه شی. مهمه نده چې موږ د کوم سیاسي ګوند سره تعلق لرو، ټول صوبايي او وفاقي حکومتونه به دی خلکو سره د مرستې لپاره کار وکړي.,,,
269,270,"austerity measures that begin with the cabinet members voluntarily surrendering their pays, perks & privileges will save the exchequer an amount of Rs. 200 billion annually. I am grateful to all coalition partners for their support. Will personally supervise the implementation",,,
270,271,Islam attaches great importance to the rights of workers. Its economic system is egalitarian & teaches us to leave no one behind. Real democracy lies in empowering workers economically. My govt is committed to raising their standard of living & honouring the dignity of their work,,,
