,Tweets
615,Takhtbai ready for Sunday's bye election as well as our Islamabad march. Never has our country been so mobilised behind a cause as it is for Haqiqi Azadi.
616,"As Pakistan is ravaged by floods, our people need to understand the disastrous impact of global climate change that results in droughts & then floods. It's imperative that we bring major changes to our environment through forests, dams, barrages & waste water treatment plants."
617,"one prov to another under multiple false FIRs against him in total violation of all laws & basic human rights enshrined in our Constitution. In contrast an absconder responsible for billions in corruption & money laundering, Salman Shahbaz, is drycleaned & returns to Pak."
618,"My 76 cases & increasing rapidly include terrorism, blasphemy & sedition. In sedition case, neither the officer is named nor institution identified. This is what happens when a bunch of criminals are imposed on a nation by those who are devoid of intelligence, morality & ethics."
619,عمران ریاض کو اس پنجرےمیں قیدکیاگیاجس میں مہذب ممالک کسی جانور تک کورکھنےکی اجازت نہ دیں۔اسے زہر دیےجانےکاشبہ بھی موجودہے۔اس میں ملوث تمام کردار شرم سےڈوب مریں۔میں لوگوں کی زبانوں پرخوف کے تالےپڑنےکی بجائےاس سب سےبدمعاشوں کےٹولے+ انکےسرپرستوں کیخلاف عوام کاغصہ ہی بڑھتاہے
620,"میں اپنے نوجوانوں کو ""عمران ٹائیگرز"" میں شمولیت کی دعوت دیتا ہوں۔

 ⁧#عمران_خان_ہماری_ریڈ_لائن"
621,گکھڑ منڈی میں (حقیقی آزادی مارچ کے) آج کےعظیم الشان استقبال کے مناظر! حقیقی آزادی مارچ کو الحمدللہ بےمثال عوامی حمایت اور پذیرائی میسر ہے۔
622,"Tragic army heli crash in which 6 soldiers were martyred, near Khost, Harnai Balochistan. My deepest condolences and prayers go to the families of these brave soldiers."
623,"against unarmed workers to stop our planned rally? The only job of Caretakers is to ensure fair & free elections. What they are doing is an assault on rule of law, our Constitution & democracy. Above all, once SC ruling is defied, it is now law of the jungle."
624,"EVMs allow for transparency & immediate results so prevent rigging - engineering of results. Right now results of LG elections which shd have come out within a few hours at most, were coming out in a staggering delay some for days, allowing for massive foul play."
625,کیا یہ ہے”ترتیبِ نو“! یہ حکومت نااہلی کےتمام ریکارڈز توڑچکی ہے۔میری سب سےبڑی پریشانی یہ ہےکہ ہمیں معاشی بدحالی کی دلدل میں دھکیلنےاور اپنےلئے NRO-2 کےبندوبست سمیت وائیٹ کالر مجرموں کو ملک لوٹنےکا لائسنس تھمانےسے ہٹ کر یہ سرکارہماری قومی سلامتی پر بھی مکمل سمجھوتہ کر گزرے گی۔
626,پیمرا کیجانب سے ٹی وی پر میرے راولپنڈی جلسے کی براہِ راست نشریات روکنےکے بعد امپورٹڈ حکومت نے میرے خطاب کے دوران یوٹیوب بند کردی۔ان حربوں سے ان عناصر میں پھیلی مایوسی جھلکتی ہے جو اپنے ذاتی مفادات کیلئےپاکستان کو سیاسی و معاشی انتشار کی دلدل میں دھکیلنے پر آمادہ و تیار ہیں۔
627,کل سویڈن میں احتجاج کے دوران قرآنِ کریم نذرِ آتش کئے جانے کی شدید ترین الفاظ میں مذمت کرتا ہوں۔گزشتہ برس مارچ میں ہماری حکومت کی کاوش کے نتیجے میں اقوامِ متحدہ کی جنرل اسمبلی نے اسلاموفوبیا کے انسداد کے عالمی دن کے حوالے سے او آئی سی کی تائید یافتہ تاریخی قرارداد منظور کی۔
628,"Today we celebrate the rich culture & traditions of Sindh going back to the great Indus Valley Civilization. It’s the land of the Sufis & freedom, but sadly, suffering under the tyranny of Zardari mafia. Sindh will rise again against the tyrant to reclaim its greatness & freedom."
629,"پاکستان کےسیلاب متاثرین کیلئےدل کھول کر مددکرنے والےتمام عطیات کنندگان، میں آپکاشکرگزار ہوں۔کئی ایک طریقےہیں جن کےذریعےآپ عطیہ کرسکتےہیں۔ذیل میں فراہم کردہ دستاویز میں پاکستان اورپاکستان سےباہررہنے والےعطیات کنندگان کیلئےتفصیلات مرتب کی گئی ہیں 
http://floodrelief2022.punjab.gov.pk/uploads/pakist"
630,"اڄ اسان سنڌ جي شاندار ثقافت ۽ روايتن کي ملهائي رهيا آهيون جيڪي قديم سنڌو ماٿري جي تهذيب سان لاڳاپيل آهن.

سنڌ صوفين جي ڌرتي آهي، پر بدقسمتيءَ سان زرداري مافيا جي جبر هيٺ آهي.

 سنڌ پنهنجي عظمت ۽ آزادي حاصل ڪرڻ لاءِ وري ظالم جي خلاف اٿندي."
631,IMF & World Bank Reports show this Imported Govt has failed to prevent economy going into tailspin despite inheriting a stabilised economy moving on an upward trajectory. This was reflected in the Economic Survey which identified our econ  performance as the best in past 70 yrs
632,"Strongly condemn arrest & imprisonment of Sindh Oppsition leader, PTI's Haleem Adil Shaikh simply to silence his voice, by the Zardari mafia. Haleem has a broken leg & is on hunger strike in jail. We demand his immediate release & an end to his political victimisation & torture."
633,"اپنےسمندر پار پاکستانیوں سےمیری التماس ہےکہ ذیل میں درج پورٹل کےذریعےسیلاب متاثرین کیلئےعطیات بھجوانے کاسلسلہ جاری رکھیں؛ 
http://floodrelief2022.punjab.gov.pk
اس پورٹل سےموصول ہونےوالےعطیات24گھنٹوں میں 2ملین ڈالرز سےتجاوز کرچکےہیں۔میں ان سب کا شکرگزار ہوں جو پہلےہی اپنا حصہ ڈال چکےہیں۔"
634,ہمیں کراچی پولیس آفس پر دہشتگردحملےمیں اپنی جان گنوانے والےاجمل مسیح کو ہرگزنہیں بھولناچاہئے۔حکومت انکے اہلِ خانہ کی کفالت کاذمہ اٹھائے۔بدقسمتی سےہم دہشت گردی کا نشانہ بننےوالےاپنےخاندانوں کےواحدکفیل شہریوں ہی کو نہیں بلکہ انکےبعدانکےزیرِکفالت افراد کوبھی باآسانی بھول جاتےہیں
635,وہ مناظر جو جیوڈیشیل کمپلیکس کےمرکزی دروازےسے داخل ہوتےہی مجھےدیکھنےکو ملے۔کوئی ابہام باقی نہیں رہناچاہئیےکہ نامعلوم افراد کےہمراہ اس ساری نفری کی وہاں موجودگی کا مقصد مجھےجیل میں ڈالنانہیں بلکہ ایک فرضی لڑائی کی آڑ میں مجھےرستےسےہٹانا اور میری موت کو ایک حادثہ قرار دینا تھا۔
636,ارشد شریف،جنہوں نے سچ بولنے کی حتمی قیمت اپنی جان سے ادا کی، کےبہیمانہ قتل پر بےحد صدمےمیں ہوں۔انہیں ملک چھوڑنا پڑا مگر بیرونِ ملک پناہ کے دوران بھی انہوں نےسماجی میڈیا پر سچ بولنےاور طاقتور لوگوں کو بےنقاب کرنے کاسلسلہ جاری رکھا۔ انکی موت پر پوری قوم آج حالتِ سوگ میں ہے۔
637,"What we left behind & how the Imported Govt, brought in through regime change conspiracy, has wreaked havoc with the economy."
638,"I want to thank everyone for responding to my call & for your generous support for Pakistan’s flood affectees. There are several ways in which you can donate. In this document details have been outlined for overseas donors as well as donors
in Paksitan.
https://floodrelief2022.punjab.gov.pk/uploads/pakistan_flood_relief_donation_details.pdf…"
639,Shocked & deeply saddened to learn  of the assassination of former SCBA President & senior advocate Latif Afridi in the Bar Room of Peshawar High Court. My deepest condolences & prayers go to his family.
640,"Despite all the challenges faced by the construction industry & difficulties in importing cancer equipment, MashaAllah Shaukat Khanum Karachi is set to open at the end of this year. SKMT Karachi will be twice the size of Lahore & will also have state of the art cancer equipment."
641,in Barkhan*
642,The fascist Imported govt & their handlers continue to target our workers & ldrship. Today they have arbitrarily arrested more than 70 of our workers in Islamabad. This is condemnable & absolutely unacceptable. They must be released immediately.
643,"& terrify us into submission, they have got it all wrong. People are more determined to stand up against this fascism & my Party & I are more resolute than ever before to fight against these fascist forces for democracy, rule of law & justice for our people."
644,We are on our way to winning Karachi NA 245 election. Our camps are full of voters while opposition camps are empty. I am asking all our voters to go immediately to vote if they haven't already done so.
645,مجھے اپنے خلاف قتل کے منصوبے کا تقریباً 2 ماہ پہلے علم ہوچکا تھا اور میں نے 24 ستمبر کو رحیم یار خان اور 7 اکتوبر کو میانوالی کے عوامی اجتماعات میں اس کا پردہ بھی چاک کیا۔ وزیرآباد میں کی جانے والی قتل کی کوشش سکرپٹ کے عین مطابق تھی۔
646,"This verse refers to human societies that remain neutral when faced with injustice & degradation of their moral values should not expect any blessings from the Almighty as He proclaimed in the Quran to “enjoin the good and forbid evil""."
647,Grand reception at Ghakkar Mandi earlier today. Massive support for Haqeeqi Azadi March.
648,بلکہ محض بھارتی لابی کی تائید و خوشنودی کیلئے اہلِ کشمیر کی بے مثال جدوجہدِ آزادی جسے ایک لاکھ کشمیریوں نے اپنے خون سے سینچا ہے، کو بھی دفن کرنے پر آمادہ و تیار ہے۔
649,"Went today with CM KP to see the flood devastated areas of DIKhan & Tank today. The level of destruction is massive & have discussed with the CM how to improve scale & speed of the assistance to affectees incl preventive measures against spread of disease, esp in children."
650,سپریم کورٹ کے 5رکنی بنچ نےصدرِمملکت کو تاریخ،جو 30اپریل کی شکل میں انہوں نے دی، کے اعلان کی ہدایت کرتے ہوئے 90 روز میں پنجاب+ پختونخوا میں انتخابات کے انعقاد کا حکم دیا۔اس انتخاب میں بمشکل 55 روز باقی تھے جب تحریک انصاف نے لاہور میں اپنی انتخابی ریلی کے انعقاد کی تیاری کی۔
651,یہ وہ المیہ ہے جو پاکستان میں جنم لے رہا ہے۔ہماری پولیس اور رینجرز کو اپنے ہی شہریوں کیخلاف وہ لوگ کھڑا کر رہے ہیں جو اپنے مفادات کیلئے عام پاکستانیوں سے جانوروں کا سا سلوک کرتے ہوئے انہیں قوت کے وحشیانہ استعمال کے ذریعے اپنی مرضی کی ڈگر پر چلانا چاہتے ہیں۔
652,"Prosecutor General, after an indep inquiry, found 4 officers guilty of destroying evidence & asked for action against them. But powerful forces have made Punjab Caretaker govt reconstitute the JIT to include all 4 of these officers with one of them, Syed Khurram Ali, as Convener."
653,"We dissolved our 2 provincial legislatures with expectation that elections would be held in 90 days as  clearly given in our Constitution. We did not take this action to allow a bunch of fascists to impose a reign of terror, violating the Constitution & Rule of Law."
654,ہےکہ آیا آپکا تصورِ غیرجانبداریت یہ ہےکہ نہتےمظاہرین اور ملک کی سب سےبڑی جماعت کےقائدین، جن کے رہنما کو ایک غیرقانونی وارنٹ کاسامنا،معاملہ پہلے ہی عدالت میں ہو اور مجرموں کی حکومت اغواء کر کے ممکنہ طور پر اسے قتل کرنےکیلئےکوشاں ہو،کے مدِّمقابل رینجرز آن کھڑےہوں؟
655,کراچی، حیدرآباد اور دادو کے عوام کو میرا پیغام ہے کہ نکلیں اور ووٹ ڈالیں۔ اگر وہ اپنی زندگیوں میں تبدیلی چاہتے ہیں تو ان کا آج کا ووٹ ضروری ہے۔
656,حقیقی آزادی کیلئےآج ہم دو بنیادی محرّکات و اہداف کےتحت  جیل بھرو تحریک کا آغاز کررہےہیں۔ اوّل: یہ ہمیں آئین کےتحت میسّربنیادی حقوق پر یلغار کیخلاف ایک پرامن اور غیرمتشدد احتجاج ہے۔ہمیں جعلی FIRs، نیب کےمقدموں، زیرِحراست تشدد، اور میڈیا و سماجی میڈیا سے وابستہ افراد پر
657,کرائم منسٹر کیجانب سےآرمی چیف کی تعیناتی اور دیگرریاستی معاملات پر عدالت سےسزا یافتہ نوازشریف سےمشاورت اور وزراء کےبیانات کہ وہ نوازشریف سے مشاورت کے بعد آرمی چیف مقرر کریں گے،سب آفیشل سیکرٹ ایکٹ (سیکشن 5:1) ہی کی خلاف ورزی نہیں بلکہ انکےعہدوں کےحلف سےبھی مکمل انحراف ہے۔
658,Work is progressing on Ravi city. With $40 bn investment portfolio it will accommodate 15 mn ppl & will be Pak's first green & smart city. Vertical riverfront development provides range of opportunities for int & national investors. Ravi City will have world's largest waterfront
659,Our Haqeeqi Azadi March moving in Gujranwala. We are on our way to a revolution as people keep swelling up our numbers. The nation is sending a clear message in support of our call for Haqeeqi Azadi.
660,I want to thank the people for coming out to vote for PTI with such jazba and janoon - such passion and commitment - to defeat the mafias in NA 193 and stand with PTI.
661,میانوالی میں ایک زچہ و بچہ اسپتال جس کی اشد ضرورت تھی، چند ہفتوں میں کھُلنے کو تیار ہے۔ پنجاب میں پانچ زچہ و بچہ اسپتال تعمیر کرنے پر میں ڈاکٹر یاسمین کو مبارکباد پیش کرتا ہوں۔
662,Congratulations to all our leadership & workers in Multan for the massive turnout today for our Jail Bharo (court arrest) tehreek. The junoon (passion) & commitment of our people shows they have broken the chains of fear.
663,سینیٹر اعظم سواتی کو برہنہ کیا گیا،انہیں تشدد کا نشانہ بنایا گیا اور انکی اہلیہ کو ایک نازیبا(غیرقانونی)ویڈیو بھجوا کر انکی تذلیل کی گئی۔ہفتوں تک وہ سپریم کورٹ سےحصولِ انصاف کےمنتظر رہےمگر انکی کوششیں بےسود ثابت ہوئیں۔جب قابلِ فہم غصےاور مایوسی کےعالم میں وہ (ان زیادتیوں پر)
664,I want to thank our PTI workers for their massive welcome for me in Islamabad today.
665,"Now on 76th case against me. Well on my way to a century of cases, with the latest case of treason filed against me for highlighting Dirty Harry's use of torture & other human rights abuses."
666,سندھ میں تازہ ترین بلدیاتی انتخابات کےحوالے سے رپورٹس کےبعد یہ واضح ہو چکاکہPPP آزادانہ و شفاف انتخابات میں قطعاً یکسو نہیں بلکہ یہ ووٹوں کےحصول کیلئےطاقت،بلیک میلنگ،پولیس اور پیسےکا (بےدریغ )استعمال کرتی ہے۔اب تو یہ بھی ثابت ہوچکا کہECP،مجرموں کے(برسرِاقتدار) گروہ اور انکے
667,کےجذبےکو کچل ڈالیں گے۔مگرکشمیریوں کی خوئے مزاحمت نےتقویت پکڑی اور یہ مسلسل مضبوط ہوتی جارہی ہے۔عالمی برادری کی (تفریق پر مبنی)منتخب اخلاقیات+بھارت کیجانب سےعالمی قانون اور UNSC کی قراردادوں کی صریح خلاف ورزی پر عالمی برادری کی خاموشی قابلِ مذمت ہے۔ہم سےکہا جاتاہےکہ انسانی حقوق کی
668,پاکستان کی بنیادیں شرفِ انسانی،خاندان کی تعظیم اور چادر و چار دیواری کی حرمت وتقدیس کےاقدار پر اٹھائی گئیں۔برہنہ کرنے، زیرِ حراست تشدد کا نشانہ بنانےاور اب ایک ویڈیو کےذریعےانکی اہلیہ محترمہ کی خلوتوں کے پردے چاک کرنے سمیت ریاست کے ہاتھوں میں اعظم سواتی کے ساتھ جو کچھ ہوا
669,"بھکر جلسہ شہر کی تاریخ کا سب سے بڑا اجتماع تھا اور سادہ سی حقیقت ہے کہ ضمنی انتخاب کے باب میں عوام کے ایسے اکٹھ کا تصور بھی محال ہے۔ پاکستان ووٹ کی پرچی سے پھوٹتے ایک انقلاب کا نظارہ کیا چاہتاہے، انشاءاللہ!
 #VoteOnJuly17"
670,"massive public support won 75% of bye elections & established itself as a truly national Party. Despite the gloom right now, esp of a possible default, I have faith in Almighty Allah & confidence in our people that without doubt in 2023 through elections PTI will form strong govt"
671,"Azam Swati's custodial torture for a tweet on NRO 2 is yet another shameful act in our history. Can torture & intimidation make people respect any individual or institution? The Holy Quran teaches us respect & humiliation are solely in Allah's jurisdiction,"
672,ہمارےحقیقی آزادی مارچ میں شرکت کیلئےآج گوجرانوالہ کےعوام غیرمعمولی تعداد میں نکلے۔ آج تک ہم نے عوام کی بہت بڑی تعداد ہی کو مارچ میں شریک ہوتے نہیں دیکھا بلکہ یہ مشاہدہ بھی کیا کہ جوں جوں ہمارا مارچ اسلام آباد کی جانب بڑھ رہا ہے، ہمارے لوگوں کے جوش و جذبے میں اضافہ ہورہا ہے۔
673,"@CBDPunjab
 کوغیراستعمال شدہ سرمائےکومعقول سرمایہ کاری میں ڈھال کر دولت کی تخلیق کی راہ ہموارکرنے کاکام سونپاگیاہے۔بےپناہ صلاحیتوں کےحامل ایسے منصوبوں کوپنجاب کےدیگراضلاع تک توسیع دی جائےگی اورمقامی+بیرونی سرمایہ کاری کیلئےمواقعوں کےذریعےمعاشی نمو+خوشحالی کااہتمام کیاجائےگا"
674,اپنی قوم کو میرا پیغام ہے کہ پوری ہمت و استقامت سے کھڑی ہو اور حقیقی آزادی و قانون کی حکمرانی کیلئے میدانِ عمل میں ڈٹ جائے!
675,اسلام آباد،لاہور اور پنجاب بھرسےPTIکے740 سےزائدنہتّےکارکن گرفتارکئےجاچکےہیں۔یہ غریب لوگ ہیں جن میں سےبیشتر دیہاڑی دار ہیں۔ مجرموں کےٹولےکو رمضان المبارک کےتقدس کا بھی احترام نہیں جس میں لوگ محفوظ طریقے سےصوم وصلوٰة میں مشغول رہناچاہتےہیں۔تمام گرفتارکارکنان کو فوری رہاکیاجائے!
676,to file more sham FIRs against PTI ldrshp & workers & to use as pretext for postponing elections. Elec Schedule has been announced so how can Sec 144 be imposed on pol activity? I AM TELLING ALL PTI WORKERS NOT TO FALL INTO THIS TRAP.  Hence we have postponed rally till tomorrow.
677,اچھی خبر:احمدربانی اور انکےبھائی گوانتاناموبےمیں20برس کی قید کاٹنےکےبعد گھر واپس لوٹ رہےہیں۔ میں نےانکی امریکہ کوحوالگی،انہیں غلط طور پر قیدکئےجانےاور انکی رہائی کیلئےبطور وزیراعظم بھی آواز اٹھائی۔ان جیسےبہت سےافراد دہشتگردی کیخلاف امریکی جنگ کی سنگین  ناانصافیوں کانشانہ بنے!
678,کو10بلین ٹری سونامی کےبعدسرسبز و شاداب کیاجا چکاہے۔لاہور میں راوی سگیاں پُل کےقریب لگائے جانے والے دنیا کے سب سے بڑے مییاواکی جنگل، جس کا میں نے گزشتہ برس افتتاح کیا، کے لگائے جانے سے پہلے اور بعد کے مناظر۔محض ایک سال کے عرصےمیں اسکی ناقابلِ یقین
679,"While our Ehsaas social welfare programmes were being appreciated internationally, under Imported govt all our efforts to make Pak a welfare state are being reversed. Most shocking is Maryam's instruction to SS to stop funding the health insurance card."
680,I am asking our Overseas Pakistanis to continue donating for flood victims through this portal: http://floodrelief2022.punjab.gov.pk The donations received from the portal exceeded $2m within 24 hours. I want to thank all those who have already contributed.
681,"In any civilised country, these two shameless people would have been jailed not just for lying so blatantly but for insulting the intelligence of our nation. This is what happens when the country is taken over by dangerous duffers who believe everyone is as dumb as them."
682,"of a cabal of crooks. All they are interested in is their NRO2 & its preservation. Therefore, despite economy tanking they are petrified of holding elections which is the only way to stabilise economy through political stabilisation."
683,ہموارکرتاہے جسکے نتیجے میں انہیں ریاستی و حکومتی اشرافیہ کے تسلط سے تحفظ ملتاہے۔بدقسمتی سےچونکہ پاکستان میں قانون کی حکمرانی کوقدم جمانےکی اجازت نہیں دی گئی، چنانچہ ملک پر اشرافیہ کی کڑی گرفت نے طاقتور مافیاز اور اداروں کو قانون سےیوں بالاتر بنایا کہ گویا یہ انکا استحقاق تھا
684,ہماری جیل بھرو تحریک کیلئے آج ملتان میں بڑی تعداد میں نکلنے پر میں اپنی ساری قیادت اور کارکنان کو مبارکباد پیش کرتا ہوں۔ہمارے لوگوں کے جنون اور عزم و استقلال سے ظاہر ہوتا ہے کہ وہ خوف کی زنجیریں توڑ چکے ہیں۔
685,I want to thank Pakistanis at home & overseas for donating Rs 2.3 bn already in response to my flood relief telethon. All those who are yet to deposit their pledges please do so. My team is working to facilitate overseas Pak who await 501 3(c) exemption for large transactions.
686,Meanwhile Punjab police have led an assault on my house in Zaman Park where Bushra Begum is alone. Under what law are they doing this? This is part of London Plan where commitments were made to bring absconder Nawaz Sharif to power as quid pro quo for agreeing to one appointment.
687,ظلم اور جھوٹ کیخلاف حق و انصاف کی سربلندی کیلئے سرگرداں تمام افراد کیلئے یہ عظیم ترین قربانی ایک متاثر کن مثال، مینارۂ نور ہے۔
688,میں شام4بجےپریس کانفرنس کروں گا۔ECPکےکردار کی نہایت موزوں وضاحت پر فواد کی گرفتاری کےبعدکوئی شک باقی نہیں رہتاکہ پاکستان قانون کی حکمرانی سےیکسرمحروم ایک بناناریبلک بن چکاہے۔ہمیں اپنےبنیادی حقوق کیلئےکھڑا ہوناہوگاتاکہ ملک کو اس مقام تک پہنچنےسےبچایاجاسکےجہاں سےواپسی ممکن نہ رہے
689,مجرموں کے گروہ کی زیرِنگرانی قانون کی حکمرانی کا خون اسلام آباد پولیس کے ہاتھوں 3 بچوں، 12 سالہ اسد، 13 سالہ عثمان اور 14 سالہ ثاقب کےتحریک انصاف کے”دہشتگرد“کے طور پر اٹھائے جانے سے ظاہر ہے۔ اب انہیں ہمارے جووینائل قانون کے برخلاف عدالتی ریمانڈ پر جیل بھجوا دیا گیاہے۔
690,Saddened to learn of the passing of SM Muneer. He was on our SKMT Board and one of our most generous donors. My prayers & condolences go to the family.
691,I am inviting everyone to join us tomorrow and raise their voice in protest.
