,Tweets
0,ہمارےمکمل طور پر نہتے،جانثار اور پرجوش کارکن علی بلال کو پنجاب پولیس نےشہیدکردیا۔انتخابی ریلی میں شرکت کیلئےآنے والےنہتےکارکنان کیساتھ ایسا وحشیانہ سلوک نہایت شرمناک ہے۔پاکستان اس وقت خون کے پیاسےمجرموں کےچنگل میں ہے۔ہم IG، CCPO اور دیگر کیخلاف قتل کے مقدمات درج کروائیں گے۔
1,Today would have been Arshad Sharif's 50th birthday. We will always remember his supreme sacrifice for Pakistan. It is imperative that those responsible for his assassination must be brought to justice & punished.
2,"After what happened to Arshad Sharif despite his writing to the President about the life threats he was facing, I would urge the CJP to take notice of this before it is too late."
3,& bring about substantive structural reforms to get Pakistan out of the crisis the Imported govt & its backers have plunged the country into.
4,جیساکہ میں نے6ماہ قبل ہی پیش گوئی کردی تھی کہ تبدیلئ سرکارکی سازش قرض کی واپسی کی ہماری صلاحیت نیست و نابودکرتےہوئےہماری معیشت کوتباہی کےگھڑےمیں اتار دےگی۔پاکستان پر کم وبیش 3 دہائیوں تک راج کرنے والےدومجرم خاندان معیشت کی تعمیرمیں کبھی سنجیدہ تھےنہ ہی ان میں اسکی صلاحیت تھی
5,چونکہ پاکستان سیلاب کی تباہ کاریوں کی زد میں ہے چنانچہ ہمارےلوگوں کو عالمی ماحولیاتی تغیرات کہ جنکےنتیجےمیں خشک سالی سراٹھاتی ہےتوکبھی سیلاب آتےہیں،کےتباہ کن اثرات کو سمجھنا ہوگا۔ لازم ہے کہ ہم جنگلات، ذخائرِآب، بیراجز اور گندے پانی کی صفائی کےمنصوبوں کے ذریعے اپنے ماحول میں
6,سماج کی اخلاقی بنیادوں پربھی سنگین حملہ ہے۔عدالتِ عظمیٰ نےکارروائی کی ہوتی اور ان لوٹوں کو تاحیات نااہل کیا ہوتا تو اس سلسلےکی روک تھام کاکچھ بندوبست ممکن ہوتا۔کیا تبدیلئ سرکار کی امریکی سازش سے آنے والی امپورٹڈحکومت کے سرپرستوں کو قوم کےاس سنگین نقصان کاکچھ بھی احساس نہیں؟
7,جو نتائج آرہے ہیں ان کی روشنی میں تحریک انصاف کم از کم 15 نشستیں جیت رہی ہے۔ مگر تمام پولنگ سٹیشنز پر ذمہ داریوں پر مامور ہمارے سب لوگوں کیلئے نہایت اہم ہے کہ ریٹرننگ افسران سے سرکاری نتائج کے حصول تک اپنی جگہ بالکل نہ چھوڑیں۔
8,"Strongly condemn arrest of Siddique Jan Bol news Bureau Chief Islamabad Anyone thought to be pro PTI is now brazenly targeted. Imran Riaz,Jamil Faruqi, Sabir Shakir,Sami Ibrahim,Ch Ghulam Hussain,Moeed Pirzada - all victimised. Arshad Sharif murdered. BOL & ARY owners targeted."
9,"اسکے ساتھ وہ تین بیراجز جو راوی اربن ڈیویلپمنٹ اتھارٹی کا حصہ ہیں، پانی بچائیں گے اور زیرِ زمین پانی کے تیزی سے کم ہوتےذخائر کو پھر سے بھریں گے۔ 
 #floods #water #rivers"
10,"استعمال کرنے کی کوشش کررہا ہے۔ ہم بہادر فلسطینیوں کے ساتھ کھڑے ہیں اور عالمی قوتوں سے مطالبہ کرتےہیں کہ اپنا سکوت توڑیں اور اہلِ فلسطین کیخلاف اسرائیلی سفاکیت و بربریت کیخلاف اقدام کریں۔ امن صرف دو ریاستی حل جیسے ایک قابلِ عمل منصوبے ہی سے ممکن ہے۔ 
 #GazaUnderAttack"
11,ہمیں کوریجز سےمحروم کرنےکیلئےیہ میڈیاہاؤسز پر دباؤ ڈالتےہیں اور اگرپھربھی کوئی چینل ہمیں کوریج دیتا ہے تو اس پر حملہ کردیا جاتاہے۔مگر اس سب سےکچھ فرق نہیں پڑتاکیونکہ لاہور اپنافیصلہ سنا چکاہےکہ جہاں سارا دن لوگ بڑی تعدادمیں نکلتے+تقریباً7گھنٹوں تک ہماری ریلی میں پیدل چلتےرہے
12,"Facing a tyrant's army that far outnumbered them, Imam Hussain AS with his family & companions laid down their lives at Karbala standing resolute for Haq (truth/right) against Baatil (falsehood)."
13,"All those who support democracy & the right to freedom of expression as enshrined in our Constitution must come out & protest against arrest of 
@ImranRiazKhan
 & ongoing violence & targeting of journalists incl 
@ayazamir
 & many others just to instil fear & silence critical voices."
14,ایک آزاد و خودمختار پاکستان کے حصول اور امپورٹڈ سرکار کو مسترد کرنے کے حوالے سے عوام میں پایا جانے والا جذبہ نہایت واضح ہے۔
15,این اے 245 کراچی کے انتخاب میں ہم جیت کی جانب گامزن ہیں۔ ہمارے کیمپس ووٹرز سے بھرے ہوئے ہیں جبکہ مخالفین کے خیمے خالی ہیں۔ میری اپنے تمام ووٹرز کو ہدایت ہے کہ اگر آپ نے ابھی تک اپنے ووٹ کا حق استعمال نہیں کیا تو فوراً جائیں اور ووٹ ڈالیں۔
16,"میں اپنےاوورسیز ڈونرز کامشکورہوں جنہوں نے جب ہم سیلاب زدگان کیلئے(عطیات بھجوانےکیلئے)اکاؤنٹ بنارہے تھے،صبرسےانتظارکیا۔تفصیلات یوں ہیں؛
عنوان: Insaf Relief Foundation 
نمبر. 7004109
Southwestern National Bank; 2951 West Ball Road,Suite 100
Anaheim,CA 92804
tel:714-822-6101"
17,We saw a foreign abetted regime change conspiracy taking place sending Pak into chaos. But senior Judiciary continues to remain aloof. When will the Judiciary move to act against State institutions that are defying all laws & violating the Constitution? It is high time they did.
18,The sheer magnitude of the flooding that I saw in Tank & DIKhan shows the challenge Pakistan is confronted with as this is the situation in many other areas across the country.
19,"بڑھتی ہوئی مہنگائی اور بیروزگاری کےدوران امپورٹڈسرکار نے اسلام آبادکےI-10 سیکٹر میں ہماری حکومت کیجانب سے
”احساس ریڑھی بان“پروگرام کےتحت فراہم کی گئی ریڑھیاں/سٹالز تباہ کرکےنہایت بےحسی کامظاہرہ کیاہے۔کمزوروں اور غریبوں کو جان بوجھ کر نشانہ بنانا غیرانسانی اور قابلِ مذمت عمل ہے"
20,Condemnable arrest of Lt Gen retd Amjad Shoaib shows democracy & freedom being totally destroyed in Pak to save regime change conspiracy's fascist order of cabal of crooks propped by handlers. It is time for every Pakistani to stand up for Haqeeqi Azadi & save Pak from the abyss.
21,اسی دوران پنجاب پولیس نے زمان پارک میں میری رہائشگاہ پر دھاوا بول دیا ہےجہاں بشریٰ بیگم اکیلی ہیں۔ کس قانون کے تحت یہ لوگ یہ سب کر رہے ہیں؟ یہ لندن پلان کا حصہ ہے جس کے تحت ایک تقرری پر رضامندی کے عوض مفرور نواز شریف کو اقتدار میں لانے کے وعدے کئے گئے۔
22,of voluntary return a person cannot hold any public office at federal or prov level nor in any state org. ECP has helped reduce Pak to a Banana Republic making our democracy a joke. I will be holding a presser tomorrow to expose this entire farce.
23,Saddened to learn of the passing of Jaffar Leghari. He was a friend for the last four decades. Sadly he lost his battle with cancer despite putting up a great fight. My condolences & prayers go to his family. May Allah give them the strength and patience to bear this loss.
24,تمام تر مشکلات کے باوجود بلدیاتی انتخابات میں تحریک انصاف کی کامیابی پر پاکستان تحریک انصاف آزاد جموں و کشمیر اور سردار تنویر الیاس کو مبارکباد پیش کرتا ہوں۔
25,ناانصافی پر انکےقابلِ جواز غصے اور مایوسی کو ہوا اس وقت ملی جب سینیٹرز کیجانب سےگزشتہ دو ہفتوں سے اپنی حمایت میں کی جانےوالی استدعاؤں کے باوجود سپریم کورٹ کے دروازے ان پر بند رہے۔چنانچہ انہوں نے ٹویٹ کیا اور پھر سے دَھر لئے گئے۔ریاست کی اس فسطائیت کیخلاف ہر فرد آواز بلند کرے!
26,ان سب کیلئےجو لاہور میں میری ملاقات کی افواہیں پھیلا رہےہیں،ہماری واپسی کی وجہ یہ تھی کہ لاہورقریب تھا+ ہم پہلےہی رات کوسفر نہ کرنےکافیصلہ کرچکےتھے۔پچھلے6 ماہ سےمیرا واحدمطالبہ صاف شفاف انتخابات کےفوری انعقاد کی تاریخ رہی ہے۔اگر مذاکرات ہوئےبھی تو میرا واحدمطالبہ یہی رہے گا
27,"After Pemra blocked live transmission of my Pindi jalsa speech on TV channels, Imported govt blocked YouTube midway through my speech. This just shows the desperation of those who for their self interest are willing to push Pakistan towards political and economic chaos."
28,Our billion tree tsunami prog for environment protection & to counter impact of climate change esp for our future generations already having an impact on our environment & wildlife. 2500 acre barren land of Changa Manga forest before 2020 - turned green after 10BTT plantations.
29,زلزلے کی تباہ کاریوں میں قیمتی جانوں کے ضیاع پر ہم ترکیہ، شام اور لبنان کے اپنے بھائیوں سے دلی ہمدردی اور تعزیت کا اظہار کرتے ہیں۔ ہم اپنے ان بھائیوں کیلئے درکار ہرقسم کی مدد و معاونت کیلئے تیار ہیں۔
30,کی ذمہ دارہےاور کون یہ آڈیوز جاری کررہاہے جن میں سےبہت سیedited/doctored ہیں۔یہ تحقیق  نہایت اہم ہےکیونکہ قومی سلامتی سےجڑےحساس موضوعات(پرگفتگو وغیرہ) کوغیرقانونی طور پر ریکارڈ،پھر ہیک کیاگیا۔نتیجتاًپاکستان کی قومی سلامتی کےحوالے سےمعلومات پوری دنیاکےسامنےآشکار ہوکر رہ گئیں
31,کیلئےعطیات جمع کرنےکی راہ میں روڑے اٹکانے کی کوشش کی۔ یہ بےحسّی ناقابلِ تصوّر ہے! اس سب کے باوجود ہم محض 2 گھنٹوں میں 5.2 ارب روپے جمع کرنےمیں کامیاب رہے۔میں دیارِغیرخصوصاًامریکہ میں مقیم پاکستانیوں سمیت عطیہ کرنے والے ہر ایک فرد کا مشکور ہوں۔
32,اسلام آباد میں فسطائیت اپنے عروج پر ہے جہاں پولیس ہمارےکارکنوں کو پکڑنےکیلئےبغیر وارنٹس گھروں پر چھاپےمار رہی ہے۔جہاں کارکن گھروں میں موجود نہیں وہاں10برس تک کےکم سِن بچوں کو اٹھایاجارہاہے۔ہمارےوہ تمام کارکن اور ان کےبچے فوراً رہا کئے جائیں جنہیں اغواء کیا جاچکاہے!
33,"This in turn protects them from elite capture of the State & govt. Unfortunately in Pakistan bec Rule of Law was never allowed to be established, elite capture of the country has allowed powerful institutions & mafias to remain above the law as if it was their right."
34,سلسلہ جاری ہے۔ ہم حکومتی اداروں کیجانب سے جھوٹے مقدموں کے اندراج اور اختیارات کے غلط استعمال میں اضافہ دیکھتے ہیں۔ہم نے اپنی نگاہوں کے سامنے بیرونی مدد سے پاکستان میں تبدیلئ حکومت کی سازش پروان چڑھتے اور پاکستان کو طوائف الملوکی کی بھینٹ چڑھتے دیکھا۔ مگر اعلیٰ عدلیہ خاموش تماشائی
35,اس میں3بیراج ہوں گےجن سے270ارب لٹر پانی کی بچت ہوگی جسکی لاہورکےزیرِزمین ذخیرۂ آب کواشد ضرورت ہے۔گزشتہ برس شروع کیاجانےوالا 5000 ایکڑرقبےپر محیط جنگل کا ماحول دوست رکھ جھوک منصوبہ بھی اسکاحصہ ہے۔سیلاب سےبچاؤ کیلئےقدرتی مٹی سےجدید انداز میں پُشتےبھی تعمیر کئے جائیں گے۔
36,پی ڈی ایم اور کرپشن کے پیسے پر پلنےوالی ایک بگڑی خاتون مریم کے SC کےججز پر شرمناک اور سوچےسمجھےحملوں کا واحد ہدف انتخابات سےفرار ہےاگرچہ یہ آئین کو روند کر ہی حاصل ہو۔سپریم کورٹ آف پاکستان پرحملوں سےیہ گروہ پاکستان میں جنگل کاقانون راسخ کرنےکےساتھ وفاق کوشدید نقصان پہنچا رہاہے
37,Imported govt of cabal of crooks & their handlers stooped to new lows last night when they tried to blackout my telethon for flood relief fund raising. First they pressured channels not to air telethon. When some channels continued to air telethon they threatened cable operators.
38,"Strongly condemn the repeated police raids on Pervez Elahi's home in Gujrat as well as arbitrary arrests & abductions of his supporters & those who worked with him. This is naked fascism on the part of Imported Govt & their Handlers, simply to spread fear in all who support us."
39,ماحول کےتحفظ اورخصوصاًاپنی آئندہ نسلوں کو موسمیاتی تغیرات کےاثرات سےمحفوظ بنانےکےلیے متعارف کروایاجانےوالا ہمارابلین ٹری سونامی پروگرام پہلےہی ماحول اورجنگلی حیات پرمثبت اثرات مرتب کررہاہے۔2500 ایکڑرقبےپرمحیط چھانگامانگا کی 2020سےپہلےکی ویران زمین
40,میں یہ نغمہ شہید علی بلال، جسے پیار سے ظلِ شاہ کے عُرف سے جانا جاتا تھا، سے منسوب کرتا ہوں۔ وہ ایک مخصوص انداز میں اپنے وطن سے محبت کرتاتھا۔ دورانِ حراست تشدد سے اسکی اذیت ناک موت ان پستیوں کو ظاہر کرتی ہے جن میں ہماری کرپٹ،بےرحم اور ظالم مقتدر اشرافیہ اتر چکی ہے۔
41,"After getting reports on the latest LG elections in Sindh it is apparent that the PPP has no commitment to fair & free elections. Instead it uses force, blackmail, police harassment, money to get votes. Now also clear why the ECP, Cabal of Crooks & their handlers sabotaged EVMs."
42,عمران ریاض،سمیع ابراہیم اور ایاز امیرجیسے دیگر صحافیوں نےدھمکیوں،پرتشددحملوں اورگرفتاریوں کا سامناکیا۔میڈیا اور آزادئ اظہار کے معاملے کو میں آئندہ ہفتے سے اپنی ملک گیر عوامی رابطہ مہم کا حصہ بناؤں گا۔اگر ہم نے محض مجھےاور PTIکونشانہ بنانے کیلئےاختیارکئےگئے
43,عارضۂ قلب میں مبتلا74سالہ سینیٹرسواتی کو فوراً رہا کیا جائے۔کیونکہ اوّل توانہوں نےایساکوئی جرم ہی نہیں کیا کہ اس ذہنی وجسمانی اذیت کےمستحق ٹھہریں۔ دوم یہ کہ انکےخلاف خودسَری اور انتقام پر مبنی اقدامات سےہماری فوج کی ساکھ، جو کہ ایک مضبوط پاکستان کیلئے ناگزیرہے، پر حرف آتاہے۔
44,میں ان تمام لوگوں کامشکور ہوں جو کل ہمارے راولپنڈی آزادی مارچ میں اتنی بڑی تعداد میں شریک ہوئے۔ جب تک ہم (ملک میں) قانون کی حکمرانی قائم نہیں کر لیتے اور حقیقی آزادی کی مراد نہیں پا لیتے،ہماری تحریک جاری رہے گی۔
45,"Strongly condemn fascist Modi govt's continuing torture of Kashmiri leader Yasin Malik in Tihar jail forcing him to go on hunger strike. His life is in extreme danger. I call on UNSG, UNHCHR & internatonal human rights orgs to take action against India & save Yasin Malik's life."
46,I have called on govt of Punjab to immediately provide flood assistance to ppl in the devasted areas of South Punjab & in the affected areas of Mianwali distt. I have also asked the KP govt to immed provide flood relief to the ppl in affected areas of Balochistan.
47,"Your Zakat enables us to transform lives. Together, we can #EasetheBurdenofCancer & make a difference that will last a lifetime. This Ramazan, give your #Zakat & donations to Shaukat Khanum Hospitals for the treatment of deserving cancer patients. 
Visit http://bit.ly/Zakat23"
48,Had an excellent meeting with Allama Raja Nasir & MWM delegation yesterday. All misunderstandings were cleared & they reiterated their commitment to our struggle for Haqeeqi Azadi. I assured them we would resolve any problems they may face in KP & Punjab.
49,But all this is doing is stoking a dangerous slide into anarchy by pitting the people against the govt. #PakistanUnderFascism
50,چونکہ حقیقی آزادی کیلئے ہمارا لانگ مارچ پھر سے شروع ہوچکا ہے چنانچہ میری اپنے تمام کارکنان کو ہدایت ہے کہ رستوں کی بندش کا سلسلہ فوری طور پر ختم کردیں۔
51,یہ ویڈیو شریف مافیا کی پوری حقیقت بیان کرتی ہے۔ جنہیں خریدا نہیں جاسکتا انہیں مٹایا جانا ضروری ہے۔
52,فسطائی امپورٹڈ حکومت نےآج میرے خطاب کی ٹی وی پر براہِ راست نشریات روک کر اور لیاقت باغ میں میری تقریر کے دوران عارضی طور پر یوٹیوب بند کرکے ایک نئی گراوٹ کا مظاہرہ کیا ہے۔ صحافیوں کو مسلسل دھمکانے اور چینلز کی نشریات بند کروانے کے بعد بھی یہ سب کیا گیا۔
53,میں اپنی قوم کو امپورٹڈسرکار اور ریاستی مشینری کیجانب سےان میڈیاہاؤسز اورصحافیوں کیخلاف کریک ڈاؤن کی ایک نہایت غیرمعمولی مہم کےبارےمیں متنبہ کرناچاہتاہوں جو PTI اور میرا بیانیہ عوام تک پہنچاتےہیں۔دوصحافیوں،ارشدشریف اورصابرشاکر کو اپنی جانیں بچانےکی فکر میں پاکستان چھوڑنا پڑا۔
54,"This was our second jalsa in Faisalabad in the last two months. This was even bigger than the first one. MashaAllah, Pakistan has changed and evolved politically. Only politically aware nations break the shackles of mental and physical slavery."
55,خلاف اسی طرح زبردستی جھوٹے بیانات حاصل کئےجائیں جس طرح یہ سوشل میڈیا کارکنان کیخلاف کررہے ہیں۔ یہ سب بالکل ناقابلِ قبول ہے۔ہم شہبازگِل پر تشدد ہی کیخلاف نہیں بلکہ اپنےخلاف کی جانےوالی ہر ماورائےآئین وقانون کارروائی کے تدارک کیلئے تمام ممکنہ قانونی اور سیاسی اقدامات اٹھائیں گے۔
56,جنرل (ر) پرویز مشرف کی رحلت کے موقع پر میری دعائیں اور ہمدردیاں ان کے اہلِ خانہ کے ساتھ ہیں۔ اللہ کریم انہیں اس صدمے کا بار اٹھانے کی سکت اور قوت عطا فرمائیں۔
57,حقیقی آزادی کے حوالے سے ہمارے نوجوانوں میں موجود تڑپ ہی تو ہے جس کیلئے میں نے ہمیشہ رب العزت سے دعا کی کہ ایک روز میری قوم کو اس سے آشنا کردے! وہ قومیں جن کے نوجوان آزادی کو اپنی زندگیوں سےبالا شمار کرتےہیں، واقعتاً کارنامے سرانجام دیتی ہیں۔
58,"Now the Kings of Crime, Zardari & SS having gotten their NRO2 are using their salvaged looted money to purchase Punjab MPAs making a mockery of laws & desecrating our Constitution.I am asking ppl of Pak that just as they came out & thwarted plan to steal Punjab election on 17July"
59,Bhakkar jalsa was biggest in its history and such a huge gathering is simply unimaginable for a bye election. Pakistan InshaAllah is about to wittness a revolution through the ballot box. #VoteOnJuly17
60,دہشتگردی کےانسداد کی ایک مربوط پالیسی کی مکمل عدم موجودگی+انٹیلی جنس وسائل کےلغو، بیہودہ اور جعلی آڈیوز/ویڈیوز کی تیاری پر ارتکازکیساتھ ہمیں دہشتگردی میں خطرناک اضافےکاسامناہےاورہمارےسیکیورٹی اہلکاربطورِ خاص اسکاہدف ہیں۔ہم دہشتگردی کی ان کارروائیوں+ دھمکیوں کی شدیدمذمت کرتےہیں
61,جس انداز میں سینیٹرسواتی کو نشانۂ انتقام بنایاجارہاہے وہ نہایت افسوسناک اور قابلِ مذمت ہے۔سینےمیں شدید درد اور سانس میں دشواری کےباعث انہیں صبح سویرےپمزمنتقل کیاگیا۔انکےٹیسٹس کےنتائج آنا باقی تھےکہ کوئٹہ پولیس نےانکی جان سےکھیلتےہوئے انہیں اسپتال سےفارغ کروایا اور ساتھ لےگئی
62,ضیاءمحیِّ الدین کی رحلت پر افسردہ ہوں۔میری ان سے شناسائی دہائیوں پرمحیط ہے۔وہ نہایت مہذب اوراردو ادب کےحوالےسے خاص طور پر ایک وسیع المطالعہ شخصیت تھے جنہیں تفریح کی دنیا میں ایک ادارےکامقام حاصل تھا۔وہ ہماری یادوں کاحصہ رہیں گے۔میری دعائیں اور ہمدردیاں انکےاہلِ خانہ کےساتھ ہیں
63,Total mismanagement of our economy by a corrupt & incompetent imported govt has crushed masses & salaried class with latest hike in petrol & diesel prices & Rs33/$ devaluation to Rs262.6/$. Elec & gas price hike & 35% unprecedented inflation expected with Rs200bn mini budget.
64,"In Ravi city, RUDA successfully conducted tests to convert toxic waste water into water fit for aquatic life. These treatment plants shall be the first of their kind on municipal level to convert Ravi into fresh perennial body."
65,Amazing turnout in Bahawalpur last night at my Haqiqi Azadi jalsa. Women participation was unprecedented despite the hot and humid conditions. And what stood out was the high level of understanding of all current issues by the record crowd. Thank you Bahawalpur.
66,ہرقسم کی دھمکیوں+دشنام درازی کےباوجودثابت قدم رہنے اورآئین وقانون کی بالادستی یقینی بنانےپر میںSCکےاپنے ججزکوخراجِ تحسین پیش کرتاہوں۔میں بیرسٹرعلی ظفر+انکی ٹیم کابھی مشکورہوں۔ضمنی انتخابات کےدوران غیرمعمولی تعداد میں دھاندلی کیخلاف نکلنےپراہلِ پنجاب بھی تحسین وتشکر کےمستحق ہیں!
67,لیفٹیننٹ جنرل (ر) امجدشعیب کی قابلِ مذمت گرفتاری ظاہر کرتی ہے کہ سرپرستوں کی آشیرباد سے تبدیلئ سرکار کی سازش سےجنم لینے والے مجرموں پرمشتمل سفّاک بندوبست کو بچانے کیلئے پاکستان میں جمہوریت اور آزادی کو پوری طرح تباہ کیا جا رہاہے۔
68,میں سازش اور ہارس ٹریڈنگ کے ذریعے قوم پر مسلط کردہ اس امپورٹڈ سرکار کو ہرگزتسلیم نہیں کرتا۔10 ماہ میں اس حکومت کے ہاتھوں معیشت کی تباہی، ننگی فسطائیت کے ذریعے جمہوریت کے قتل، قانون کی حکمرانی اور بنیادی حقوق کے خاتمے
69,"If anyone wants to understand why Pakistan's economy is now a disaster, just 2 incidents provide the answer. 75 year old Senator Azam Swati has been subjected to custodial torture, beaten up in front of his grandchildren, his house vandalised & sealed, & he is being dragged from"
70,"This is a message to my team when they contest the Punjab bye elections on Sunday against PMLN, the state machinery, the biased Election Commission plus Mr X and Mr Y. #بلا_چلاؤ_ملک_بچاؤ"
71,Even my parked car with no one inside was attacked with windows smashed. This is pure fascism being carried out at behest of IG Islamabad backed by the Neutrals to create terror in ordinary citizens who support PTI.
