,Tweets
384,پوری ریاستی مشینری اور الیکشن کمیشن کی شرانگیزیوں کے باوجود پنجاب کےضمنی انتخابات میں نون لیگ کی شکست کےبعد چیف الیکشن کمشنر اور الیکشن کمیشن آف پاکستان نے امپورٹڈ حکومت کے ساتھ مل کر تحریک انصاف کیخلاف ٹیکنیکل ناک آؤٹ کی سازش رچائی ہے۔ اب عام انتخابات میں پوری PDM کے
385,I extend my congratulations to President Erdogan & the people of Turkiye on Democracy & National Unity Day of Turkiye (Demokrasi ve Milli Birlik Günü). 15 July 2016 commemorates the day President Erdogan with the support of the Turkish people defeated attempted coup against him.
386,"کو(این آر او-ٹو کےذریعے)جھاڑ پونچھ کر پاک صاف کر دیا گیا ہے اور وہ پاکستان لَوٹ آیا ہے۔ 

رسولِ مکرّم ﷺکی وہ حدیثِ مبارکہ ہر کسی کے پیشِ نظر رہنی چاہئیے جس میں انہوں نے تنبیہ کی تھی کہ ناانصافی کیسے قوموں کو تباہی سے دوچار کرتی ہے!"
387,LIVE | Chairman PTI Imran Khan's Historic Speech at Jalsa in #Peshawar | #PTI's Powershow
388,Strongly condemn the terrorist suicide attack in police lines mosque Peshawar during prayers. My prayers & condolences go to victims families. It is imperative we improve our intelligence gathering & properly equip our police forces to combat the growing threat of terrorism.
389,حوالےسے کوئی ابہام اب باقی نہیں رہناچاہئے! یہ بھی ثابت ہو چکا کہ لاہور میں کئے جانے والے محاصرے کا مقصد ایک مقدمے میں مجھے عدالت میں پیش کرنا نہیں بلکہ کسی زندان میں قید کرنا تھا تاکہ میں اپنی انتخابی مہم نہ چلا سکوں۔
390,"Wishing Muslims everywhere Eid Mubarak. As we celebrate & thank Allah for his blessings this Eid that commemorates sacrifice, let us remember & pray for those who are without their loved ones & for the people of IIOJK & Palestine suffering oppression under brutal Occupation."
391,"Article 14 of our Constitution refers to ""Inviolability of dignity of man""; so my question to our Honourable SC Judges is whether this provision is only applicable to the powerful of the State & for everyone else there is no protection of their basic human dignity?"
392,16دسمبر وہ دن ہےجسےقوم کبھی فراموش نہیں کرےگی: یہ وہ دن ہےجب آرمی پبلک سکول،پشاور کےمعصوم بچوں اور انکے اساتذہ پر حملےکی شکل میں ہم پر تاریخ کا سب سےہولناک دہشت گرد حملہ کیاگیا۔یہی وہ دن ہےجب ہم بحثیت قوم یکجاہوئے اور دہشتگردی سے نمٹنے،اس ناسور کو جڑ سےاکھاڑ پھینکنےکاعزم کیا۔
393,مملکتِ سعودی عرب کا وزیراعظم مقرر کئے جانے پر ولی عہد محمد بن سلمان کو بہت مبارک! آپ کی دوستی اور معاونت پاکستان کیلئے انمول ہے اور آپ اپنے ویژن کی بناء پر مملکت کو ایک نئےدور سےروشناس کرائیں گے۔
394,PTIکےنوجوان ٹائیگرطحہٰ شیخ کی رحلت کا جان کر نہایت افسردہ ہوں۔7 اکتوبر کو اسےاسکی رہائشگاہ کےسامنےبظاہر ایک سوچےسمجھےمنصوبےکےتحت نشانہ بنایاگیا۔طحہٰ زخموں کی تاب نہ لاتےہوئےچل بسا۔سندھ پولیس تاحال ذمہ داروں کوگرفتارنہیں کرسکی۔میری دعائیں اورہمدردیاں اسکے اہلِ خانہ کیساتھ ہیں
395,گزشتہ دو ماہ کے دوران فیصل آباد میں یہ ہمارا دوسرا جلسہ تھا۔ ہمارا یہ اجتماع پہلے جلسے سے بھی بڑا تھا، ماشاءاللہ۔ پاکستان بدل چکا اور سیاسی طور پرکہیں آگےبڑھ چکا ہے۔ سیاسی شعور کی حامل اقوام ہی فِکر و وجود پر پڑی غلامی کی بیڑیاں توڑتی ہیں۔
396,سینئر وکیل اور سپریم کورٹ بار ایسوسی ایشن کے سابق صدر لطیف آفریدی کے پشاور ہائیکورٹ کے بار روم میں قتل کے بارے میں جان کر نہایت افسردہ اور غمگین ہوں۔ میری دعائیں اور دلی ہمدردیاں ان کے اہلِ خانہ کے ساتھ ہیں۔
397,"With a complete vacuum of a cohesive  counter terrorism policy & a bizarre intel focus on manufacturing doctored audios & videos, we are seeing a dangerous rise in terrorism with our security personnel being specific targets. We strongly condemn these terrorist acts & threats."
398,جو ہمیں ہمارے اعمال کے مطابق ان میں سے کسی ایک کا حقدار بناتا ہے۔ وہ سب جنہوں نے سب سے بڑے مجرموں کو قومی خزانے پر اربوں کا ڈاکہ ڈالنے کے بعد احتساب سے فرار ہی کی نہیں بلکہ ایک مرتبہ پھر اقتدار میں آنے کی اجازت دی، انکے مقدر میں ذلت لکھی جاچکی ہے۔
399,"As our Long March for Haqeeqi Azadi has resumed once again, I am calling on all our workers to end their road blockades with immediate effect."
400,سندھ میں اس مافیاکی مخالفت کی جسارت کوئی نہیں کرتا۔جو ہمت کرتےہیں انہیں بھاری قیمت چکاناپڑتی ہےجیساکہ حلیم شیخ کےباب میں ہم نےدیکھا۔ گزشتہ بلدیاتی انتخابات دھاندلی زدہ تھےاور15% بلا مقابلہ ہی منتخب ہوگئےکیونکہ جو PPP کیخلاف میدان میں اترناچاہتےتھےانہیں خوفزدہ کردیاگیا۔
401,ہوجائےگا۔ہم نےاپنی 2 صوبائی اسمبلیاں اس امید پرتحلیل کیں کہ 90 روز میں انتخابات کروائےجائیں گے،جسکا ہمارا دستور واضح حکم دیتاہے۔ہم نےیہ قدم فسطائیوں کےایک ٹولے کو آئین سےانحراف اور قانون کی حکمرانی سےفرار کےذریعےخوف و دہشت کا راج قائم کرنےکی اجازت دینے کیلئےنہیں اٹھایا تھا۔
402,میں اس کڑےپراپیگنڈےپر نگاہ رکھےہوئےہوں جومجرموں کاPDMنامی گروہ میرےخلاف کررہاہے۔اسکی وجہ وہ خوف ہےجس میں یہPTIکی بڑھتی ہوئی مقبولیت کے باعث مبتلاہیں۔پشاورکےآج کےجلسےمیں میں ان سب کو باضابطہ جواب دوں گاجو مجھےبدنام کرنےکیلئےمیرےالفاظ کوجان بوجھ کر توڑمروڑ رہےہیں۔بس بہت ہوگیا!
403,ان خلاف ورزیوں پرصدائےاحتجاج بلند کریں جنکی نشاندہی عالمی برادری میں طاقتور قوتیں کرتی ہیں مگر جب بھارت اورIIOJ&K میں اسکےہاتھوں انسانی حقوق کی بڑے پیمانےپرخلاف ورزیوں کامعاملہ آتا ہےتو یہی قوتیں بھارتی منڈی یا اسکےساتھ اپنے سٹریٹیجک عسکری اشتراک کےباعث مکمل خاموش نظر آتی ہیں۔
404,"How can Imported govt brought to power through US conspiracy, led by Crime Minister, who's family along with Zardari have volumes written on their corruption, be trusted with sale of national assets & that too thru bypassing all procedural & legal checks."
405,قطر میں منعقد کئے جانے والے فٹ بال ورلڈ کپ میں آرجنٹائن کیخلاف شاندار جیت پر ٹیم سعودی عرب کو مبارکباد پیش کرتا ہوں!
406,"I feel embarrassed as a Pakistani to witness the depths we have sunk to thanks to this imported regime of a cabal of crooks & their handlers. In desperation to cling to power & muzzle all dissenting voices, they have jailed a respected, patriotic Pakistani on sedition charges."
407,"Allah, the Greatest Protector, had other plans."
408,"ایک نہایت مؤثر دستاویزی فلم 
#Ehsaas2047 ملاحظہ کیجئے جس میں یہ عکس بند کیا گیاہےکہ پاکستان میں ہم نے کیسے ایک فلاحی ریاست کے تصور کو حقیقت میں ڈھالنےکےعمل کی ابتداء کی جس سےغریب اور پسماندہ ترین شہریوں کا معیارِ زندگی بلند ہوا"
409,سیلاب متاثرین کیلئے عطیات جمع کرنے کیلئے کل میں ایک اور ٹیلی تھون منعقد کروں گا۔
410,At a time of rising inflation & unemployment this Imported Govt showed its callousness again by demolishing street vendor carts in Islamabad's I 10 sector provided by our Govt under Ehsaas Rehriban prog. Condemnable inhumane act deliberately targeting the poor & vulnerable.
411,That means playing with an attacking mindset. Good luck; the whole nation is praying for your success.
412,"Pakistan was created on Islamic moral values of human dignity, honour of the family & inviolability of chadar & chardawari. What has happened to Azam Swati at the hands of the State has been a blatant violation of all these values - from being stripped naked to custodial torture"
413,حصولِ انصاف، جو ہماری حقیقی آزادی کی جدوجہد کا ایک اہم ترین جُزو ہے کیلئے کل گوجرانوالہ بھر سے نکلنے والے بڑے اور پرجوش عوامی قافلوں کے چند مناظر!
414,"Saddened to learn of the passing of Zia Mohyeddin. I knew him for decades. He was a highly cultured person, extremely well read esp in Urdu literature and an institution in the world of entertainment. He will be missed. My condolences & prayers go to his family."
415,"I thank our overseas donors who waited patiently while we were setting up an account to facilitate flood-relief donations. Details as follows:
Title: Insaf Relief Foundation 
No. 7004109
Southwestern National Bank; 2951 West Ball Road, Suite 100
Anaheim, CA 92804
tel:714-822-6101"
416,PTIکراچی کےجنرل سیکرٹری اورMPAارسلان تاج گھمن، جنہیں آج صبح اٹھا لیا گیا، کی فوری رہائی کا مطالبہ کرتاہوں۔ارسلان کا واحدقصور یہ تھاکہ اس نےکل اپنی تقریر میں ڈرٹی ہیری کا ذکرکیا۔جمہوریت کےپرخچےاڑانےکےساتھ ہمارے ہاں قانون کی حکمرانی کو پوری طرح تار تار کیا جارہا ہے۔نری فسطائیت!
417,"I am going to immediately take up the contempt issue, violation of the sanctity of my home & the violence against my workers & our domestic staff with our Judiciary."
418,"@CBDPunjab
 tasked with converting dead capital into viable transactions channeling wealth generation for the country. Similar projects with immense potential will be launched across Punjab leading to econ growth & prosperity by providing multiple opportunities for domestic & FDI."
419,"Tomorrow LHC is hearing our contempt petition. This is a very important case bec on the decision that comes will rest the future of respect for court decisions by the powerful. We will always stand by the Constitution & Rule of Law to courageously fight oppression &
 injustice."
420,"Apart from running our economy to the ground, this Imported govt has failed to deal with the 50% increase in  terrorism in Pak with incidents from Chaman to Swat to Lakki Marwat to Bannu; They have also failed to deal with attacks from the international Pak-Afghan border by"
421,"I condemn in strongest terms the violence against senior journalist Ayaz Amir today in Lahore. Pak  descending into the worst kind of fascism with violence & fake FIRs against journalists,opp politicians, citizens.When the State loses all moral authority it resorts to violence."
422,کو بھجوا رہاہوں تاکہ وہ ریاست وسرکار کیلئے کام کرنے والے ان کرداروں کو پہچان سکیں جو تحریک انصاف کے ذمہ داران اور نہتّے کارکنان کےاغواء، ان کی رہائش گاہوں پر چھاپوں، دورانِ حراست ان سے مار پیٹ کرنے اور ان پر بےدریغ تشدد آزمانے میں ملوث ہیں۔ اظہر مشوانی کو فوراًرہا کیاجائے۔
423,"This is rule of law where no one is above it; this differentiates prosperous nations from poor ones. No NROs,no qabza gps,no custodial torture for tweeting truth abt the powerful bec justice system protects the weak. Justice was bedrock of Riyasat e Madina"
424,اکتوبر تک پنجاب کےانتخابات ملتوی کرکےECP آئین سےکھلےانحراف کا مرتکب ہواہے۔آج ہر کسی کو اِس امید کےساتھ کہ یہ دستور کا تحفّظ کریں گے،عدلیہ اور قانونی برادری کی پُشت پرکھڑا ہوناہوگا۔کیونکہ آئین پر یہ سنگین حملہ اگر آج قبول کرلیاجاتاہےتو پاکستان میں قانون کی حکمرانی کا خون
425,As I had predicted 6 months back that the regime change conspiracy would throw our economy into tailspin destroying our capability to service our debts. The two crooked families who ruled Pakistan for almost 3 decades never had the integrity or competence to build our economy.
426,Great junoon in the politically aware crowd in Gujrat last night. Unprecedented women participation. We are watching a soft revolution unfold in front of us. Exciting times ahead. Thank u Gujrat.
427,افزائش ہوئی ہے۔ ہم نےلاہور میں اس طرز کے 70 سے زائد منصوبے لگائے ہیں۔ باغبانوں کا کہنا ہے کہ یہ جنگلی حیات سے بھرپور ہے اور یہ سب لاہور کے وسط میں ہے۔ بلّوکی نیچر ریزرو کا آغاز 2019 میں قبضہ مافیا سے اراضی واگزار کروانے کے بعد کیا گیا۔
428,تحریک انصاف خیبرپختونخوا کے قائدین کی قیادت میں آج لوگ بڑی تعداد میں جیل بھرو تحریک کیلئے نکلے۔ (ان لوگوں کو) بھرپور قیادت فراہم  کرنےپرتحریک انصاف خیبرپختونخوا کےاراکینِ پارلیمان اور غیرمعمولی جنون اور عزم وہمت کے اظہار پر اپنے کارکنان کو مبارکباد پیش کرتا ہوں۔
429,قوم تبدیلئ سرکار کی سازش اور پاکستان کو اس افسوسناک صورتحال کا شکار کرنے کے تمام ذمہ داروں کا احتساب کرے گی۔
430,We welcome the SC judgement. It was responsibility of SC to uphold Constitution & they have valiantly done that through their judgement today. It is an assertion of Rule of Law in Pak. We are suspending our Jail Bharo movement & moving forward with elec campaigns in KP & Punjab.
431,In Mianwali a Mother and Child Hospital which was badly needed is about to open in a few weeks. I want to congratulate Dr Yasmin for building five Mother and Child Hospitals in Punjab.
432,پنجاب حکومت نےآج کےانتخاب میںPTIرہنماؤں کی پکڑدھکڑکےذریعےعوام کو ہراساں کرکےاور ووٹوں پرغیر قانونی ٹھپوں سےدھاندلی کیلئےپوری سرکاری/ریاستی مشینری کےکھلےاستعمال کےذریعےنہایت ڈھٹائی سےSCکے احکامات+انتخابی قواعدپامال کئےہیں۔ECPاس پرآنکھیں بندکئےرہا۔عدالتیں اب کھلیں اور کارروائی کریں
433,سپریم کورٹ بار ایسوسی ایشن کا صدر منتخب ہونے پر عابد زبیری کو مبارکباد پیش کرتا ہوں۔
434,despite both having permission to be inside Judicial Complex. Hassaan Niazi was abducted immed after getting bail & later charged with sham FIRs to keep him lcoked up. I am sending pictures of IGs Punjab & ICT & of all officers indulging in this criminal behaviour to int HR orgs
435,چارسدہ کا آج کا جلسہ جس میں ایک مرتبہ پھرعوامی سمندر نےمیری حقیقی آزادی کی تحریک پر لبیک کہا۔جس حقیقت  میں اب کسی قسم کا ابہام باقی نہیں وہ یہ ہے کہ پاکستان ایک انقلاب کو ابھرتےدیکھ رہاہے۔ہم سب کو یقینی بنانا چاہئیے کہ یہ بیلٹ باکس کے ذریعے پرامن طریقے سے آئے!
436,"For the future of Pakistan the doors of PTI are open to all democratic loving forces to join our struggle for Justice, rule of law & freedom from foreign subservience - our goal of Haqeeqi Azadi"
437,راوی سٹی پر کام جاری ہے۔40ارب$کی سرمایہ کاری سےتعمیرہونےوالا یہ شہر15 ملین نفوس کی ضروریات پوری کرےگااورکاپہلاسرسبز+سمارٹ شہر ہوگا۔دریاکےکنارےتعمیر ہونےوالا یہ عمودی شہر ملکی+غیرملکی سرمایہ کاروں کیلئےبہت سےمواقع  پیدا کرےگا اور دنیاکےسب سے بڑےآبی رُخ کا حامل شہر ہوگا۔
438,It is also obvious now that the entire siege of Lahore was not about ensuring I appear before the court in a case but was intended to take me away to prison so that I am unable to lead our election campaign.
439,Let me make clear that our movement for Haqeeqi Azadi will continue alongside our flood relief work.
440,وقت آ گیا ہے کہ ہر شہری حقیقی آزادی کیلئے کھڑا ہو اور پاکستان کو پاتال میں اترنے سے بچائے۔
441,ہمیں معلوم ہےکہ آپ کے مجرم حواری اورانکے سرپرست تحریک انصاف کی مقبولیت سے خوفزدہ ہیں۔ اگر آپ ہمارےآئینی حقوق غصب کرنےاور اظہاروصحافت کی آزادی کےحوالے سےعالمی وعدوں سے انحراف کے ذمہ دار نہیں تو قوم کو یہ بتانا آپ کی ذمہ داری ہے کہ اس سب کا ذمہ دار کون ہے؟
442,آج گکھڑ منڈی میں ہمارے حقیقی آزادی مارچ کو ملنے والا فقیدالمثال استقبالیہ! جی ٹی روڈ پر جو کچھ میں دیکھ رہا ہوں اسکےبعد میرے دل میں کوئی ابہام باقی نہیں کہ راولپنڈی و اسلام آباد پاکستان میں عوامی اجتماعات (میں عوام کی شرکت) کے تمام ریکارڈز توڑ ڈالیں گے،انشاءاللہ!
443,"آپکی زکوٰۃ ہمیں اس قابل بناتی ہےکہ زندگیاں بدل سکیں۔ باہم ملکر ہم #EasetheBurdenofCancer کرسکتے اور وہ فرق پیداکرسکتےہیں جو تاحیات باقی رہے۔اس رمضان سرطان کے مستحق مریضوں کےعلاج کیلئےاپنی #Zakat و عطیات شوکت خانم اسپتالوں کودیجئے۔ 
ملاحظہ کیجئے! http://bit.ly/Zakat23"
444,"PDM leadership seen challenging us to dissolve KP & Punjab assemblies if we want elections! Now, when confronted, they are petrified of elections knowing they will be decimated. So they are maligning the SC judges & are ready to violate the Constitution to avoid elections."
445,امپورٹڈ حکومت اوراسکےپشت پناہوں کیلئےمیرا واضح پیغام: فساد کی جس دلدل میں ہم دھنستےجارہےہیں اس سےنکلنے کا واحدرستہ انتخابات کافوری اعلان اور انکا آزادانہ و شفاف انعقادہے۔کرپشن سےجمع کردہ اورمنی لانڈرنگ سےٹھکانے لگائےگئے اپنے 1100 ارب بچانے کیلئے
446,"A proper judicial investigation must be instituted to examine his own statements plus evidence that other sources have. We have descended into a state of brutality, unknown in civilised society, indulged in by the powerful against those who dare to criticise & expose wrongdoings"
447,مجرموں کےٹولےکیجانب سےلاہور بندکرنے(نقشہ ملاحظہ کیجئے) اور ہمارے2000کارکنان کوگرفتارکرنےکےباوجوداہلِ لاہور مینارِپاکستان پر ہمارےچھٹےجلسےکو ایک عظیم کامیابی بنانے کیلئےبڑی تعداد میں نکلے۔مجھےایک مرتبہ پھرمایوس نہ کرنےپر میں اپنےلاہوریوں کابطورِخاص شکرگزار ہوں۔مجھےفخرہےآپ پر!
448,اسی انجام کے امکانات نے انہیں خوف میں مبتلا کررکھا ہے۔میری اپنے تمام لوگوں کو ہدایت ہے کہ وہ آج شام 6 بجے چیف الیکشن کمشنر اور الیکشن کمیشن آف پاکستان کیخلاف پرامن احتجاج کیلئے ایف نائن پارک میں جمع ہوں۔ میں اس اجتماع سے شام 7:30 - 7:00 بجے کے درمیان مخاطب ہوں گا۔
449,Congratulations to Sahiwal leadership & team for their massive peaceful protest Jail Bharo (court arrest) movement against total violations of our fundamental rights while crushing the people in unprecedented inflation.
450,"It seems again Sec 144 has been imposed illegally solely on PTI election campaign as all other public activities are ongoing in Lahore. Only Zaman Park has been surrounded by containers & heavy police contingent. Clearly, like 8 March, Punjab CM & police want to provoke clashes"
451,"Our Quaid Jinnah was a constitutionalist & genesis of the State of Pakistan is the Constitution. Preamble to the Constitution states clearly sovereignty belongs to Almighty Allah & the State ""shall exercise its power & authority through the chosen representatives of the people."""
452,Am following intense propaganda launched by PDM cabal of crooks against me.This stems from their being petrified of PTI's soaring popularity. Today in Peshawar jalsa I will give proper reply to all those who have deliberately been distorting my words to malign me.Enough is enough
453,Imported govt has taken media & journalists' censorship & persecution to fascistic levels. Now Bol has been suspended simply because it gave us coverage. Message to all media houses is to blackout the largest & most popular national pol party from mainstream media. Unacceptable.
454,گزشتہ شب نہایت فیاضی اور سخاوت سے عطیات دینے پر میں اہلِ وطن خصوصاً اپنے سمندر پار پاکستانیوں کا مشکور ہوں۔ ہماری 3 گھنٹوں کی ٹیلی تھون میں ہمیں 5 ارب روپے کے عطیات کے اعلانات (Pledges) موصول ہوئے۔
455,My prayers and condolences go to his grief stricken family.
456,یوں محسوس ہوتاہےکہ ایک مرتبہ پھرغیرقانونی طور پر دفعہ 144محضPTIکی انتخابی مہم کیخلاف ہی نافذ کی گئی کیونکہ لاہور میں باقی تمام سرگرمیاں تومعمول کیمطابق جاری ہیں۔محض زمان پارک ہی کنٹینرز+پولیس کی بھاری نفری کےنرغےمیں ہے۔واضح طور پر CM پنجاب اور پولیس8مارچ کیطرحPTIکی قیادت+کارکنان
457,"Israeli forces again launched air strikes against besieged Palestinians, incl children,in Gaza, violating all int laws.   Israel is trying to use its massive mly power to subjugate the Palestinian ppl & eliminate those who stand up for their rights & for end to Israeli occupation"
458,سال 2022:”بیک وقت بہترین اور بدترین تھا“۔ذاتی مفاد میں گُندھی ایک سازش کے ذریعے بہترین معاشی کارکردگی دکھانےوالی حکومت کو ہٹایا گیا اور پاکستان کومجرموں کےایک گروہ کےحوالےکر دیا گیا۔اس گروہ نےمعیشت زمیں بوس کی،خود کو NRO-2 دیا اور نیب قانون میں ترامیم کے ذریعےتمام وائیٹ کالر
459,This supreme sacrifice stands as a beacon of inspiration for all who fight for justice & truth and against tyranny & falsehood.
460,Rangers firing straight into unarmed citizens at Zaman Park as if they are attacking an enemy force on the battlefield.
461,ابہام باقی نہیں کہ ہم اب ایک بنانا ریبلک بن چکے ہیں۔ اب تو جنگل کا قانون رائج ہے جہاں جس کی لاٹھی اسکی بھینس کا اصول کارفرما ہےاور دستور و قانون پوری طرح آج کےفرعونوں کے محکوم ہیں۔
462,"If this is the sort of elections ECP, the State & PDM want then the stability that elections are meant to bring will not happen. Instead such manipulated elections will only cause more agitation, polarisation & anarchy."
463,NRO 1 cost this nation dearly. The loot & plunder of these two crooked families & their associates increased our debt four times in ten years. NRO2 is even more shameful. Rs 1100 billion corruption cases are being given immunity. Daylight robbery!
